01.05.2013 22:55 77.52.76.141 б 
01.05.2013 23:00 77.122.157.95 Непобедимый waszx12
01.05.2013 23:33 92.101.32.106 Карабас 123456789
01.05.2013 23:40 95.158.48.43 агент малдер 53015581988
01.05.2013 23:45 95.158.48.43 агент малдер 53015581988
01.05.2013 23:48 193.104.85.252 crazy boy 1qazxsw2
29.05.2013 02:42 178.76.63.56 пїЅпїЅпїЅпїЅпїЅ 
29.05.2013 02:42 188.255.80.25 пїЅпїЅпїЅпїЅпїЅ 
29.05.2013 02:42 91.226.14.5 РєСЂС‹Рј С‚Р°СЂР°РєР°РЅ007
29.05.2013 02:42 85.132.10.3 РџР°С‚СЂРёР°СЂС… orxan111
29.05.2013 02:42 85.132.10.3 РџР°С‚СЂРёР°СЂС… orxan111
29.05.2013 02:42 188.255.80.25 РЁРјРѕР»СЊ safulina10
29.05.2013 02:42 188.255.80.25 РЁРјРѕР»СЊ safulina10
29.05.2013 02:42 195.58.236.66 Р СѓСЃСЊРєР° РџСѓСЃСЊРєР° vygual
29.05.2013 02:42 90.150.244.243 С‚РёРѕРјРЅРё mama67
29.05.2013 02:42 5.250.206.187 РџР°РґС‰РёР№ Р°РЅРіРµР» 010203
29.05.2013 02:42 195.58.236.66 Р СѓСЃСЊРєР° РџСѓСЃСЊРєР° vygual
29.05.2013 02:43 90.150.244.243 С‚РёРѕРјРЅРё mama67
01.07.2013 20:01 95.158.48.43 агент малдер журавель1988
01.07.2013 20:10 95.128.242.178 Растаман 486766
01.07.2013 20:10 95.128.242.178 Растаман 069388737
01.07.2013 20:48 95.128.242.178 растаман 486766
01.07.2013 21:15 178.151.105.92 Slyboots pfljk,fkj
01.07.2013 21:20 95.182.91.162  
01.07.2013 21:22 95.158.48.43 агент малдер журавель1988
01.07.2013 21:27 37.144.154.181 Falcon DJYDI55K55K13V13V1324
01.07.2013 21:45 37.229.192.165 ВНИМАНИ Я берёзка24
01.07.2013 22:01 5.248.116.197 Falcon DJYDI55K55K13V13V1324
01.07.2013 22:18 5.248.116.197 Falcon 6fa9c21374
2013-07-01 23:02 212.142.69.87 4477268 => last04ka User stuck in battle 11829.
2013-07-01 23:16 46.22.226.53 4479525 => Невидим User stuck in battle 12031.
01.07.2013 23:36 37.61.98.77 ko 
2013-07-01 23:40 37.112.39.122 4478713 => SilverV User stuck in battle 12032.
2013-07-01 23:43 176.36.164.183 4479543 => PiratKrabe User stuck in battle 12417.
2013-07-02 00:34 109.238.80.50 24296 => ЯРусский88 User stuck in battle 13002.
2013-07-02 01:25 95.86.182.73 4479522 => Неизвестный User stuck in battle 13470.
02.07.2013 01:26 164.0.71.16 Ales 506739
02.07.2013 01:32 188.134.20.187 karel 09vtufnhjy
02.07.2013 01:32 188.134.20.187 karel 09мегатрон
02.07.2013 01:33 188.134.20.187 karel 09vtufnhjy
02.07.2013 01:33 89.147.247.16 Musluman 0557069806
02.07.2013 01:33 188.134.20.187 karel 09мегатрон
02.07.2013 01:33 89.147.247.16 Musulman 0557063806
02.07.2013 01:33 188.134.20.187 karel 09vtufnhj
2013-07-02 01:44 95.86.182.73 4479522 => Неизвестный User stuck in battle 13637.
02.07.2013 03:30 92.49.236.58 intriga 19871987
2013-07-02 06:53 178.206.205.121 4479163 => Фифочка User stuck in battle 14703.
2013-07-02 07:08 178.206.205.121 4479163 => Фифочка User stuck in battle 14746.
02.07.2013 08:55 91.231.254.198 УтРеНняЯ ЗаРя 123456a
02.07.2013 08:55 91.231.254.198 УтРеНняЯ ЗаРя milashka
02.07.2013 08:56 91.231.254.198 УтРеНняЯ ЗаРя milashka
02.07.2013 08:56 91.231.254.198 УтРеНняЯ ЗаРя malishka
02.07.2013 08:56 91.231.254.198 УтРеНняЯ ЗаРя milashka
02.07.2013 08:56 91.231.254.198 УтРеНняЯ ЗаРя 123456a
02.07.2013 08:58 91.231.254.198 УтРеНняЯ ЗаРя rjvgfc2246565
2013-07-02 09:41 195.246.102.50 4479560 => Земляной User stuck in battle 15499.
2013-07-02 09:43 195.246.102.50 4479560 => Земляной User stuck in battle 15515.
2013-07-02 09:50 195.246.102.57 4479530 => Amidamaru User stuck in battle 15566.
02.07.2013 09:53 178.206.205.121 фифочка фифочка
02.07.2013 10:06 109.68.236.19 BOSS Masxad88
2013-07-02 10:21 195.246.102.50 4479560 => Земляной User stuck in battle 15756.
02.07.2013 10:53 213.87.133.174 шахиризада 741949 qq
02.07.2013 10:53 213.87.133.174 шахиризада 741949q
02.07.2013 10:54 213.87.133.174 шахиризада 741949
2013-07-02 11:56 46.211.121.197 24506 => bugaina User stuck in battle 16613.
2013-07-02 11:58 46.211.121.197 24506 => bugaina User stuck in battle 16635.
02.07.2013 12:18 93.180.199.186 SeDJey pfqrfjlyjzqrf
2013-07-02 12:32 178.216.16.138 24796 => Шейник User stuck in battle 16830.
02.07.2013 12:53 37.114.166.9 invader 010203
2013-07-02 13:27 93.79.74.130 4479055 => valyrik User stuck in battle 17290.
02.07.2013 13:38 89.147.247.16 Musluman 
02.07.2013 13:45 178.216.123.241 падший ангел 010203
2013-07-02 13:46 195.246.102.53 4479582 => Dalish User stuck in battle 17498.
02.07.2013 15:04 164.0.71.16 Ales erlan506739
02.07.2013 15:24 212.96.65.39 СтЕрВоЧкА azim86
02.07.2013 15:44 78.37.175.159 metallist 210886
02.07.2013 15:57 37.114.166.9 invader йцук123
02.07.2013 15:58 37.114.166.9 invader йцук123
02.07.2013 15:58 37.114.166.9 invader йцук123
02.07.2013 15:58 37.114.166.9 D&amp;g 
2013-07-02 16:26 188.227.212.70 4478019 => ZEPKO User stuck in battle 19277.
2013-07-02 16:46 93.79.74.130 4479055 => valyrik User stuck in battle 19443.
2013-07-02 16:46 188.227.212.70 4478019 => ZEPKO User stuck in battle 19443.
2013-07-02 16:57 195.246.102.51 4479582 => Dalish User stuck in battle 19574.
02.07.2013 18:06 95.158.48.43 агент малдер 5301558
02.07.2013 18:13 178.94.6.165 Жена критовика 
02.07.2013 18:13 178.94.6.165 Жена критовика maks1993
02.07.2013 18:13 178.94.6.165 Жена критовика maks1993
02.07.2013 18:13 178.94.6.165 Жена критовика maks1993
02.07.2013 18:14 178.94.6.165 Жена критовика maks1994
2013-07-02 18:19 93.79.74.130 4479055 => valyrik User stuck in battle 20553.
02.07.2013 18:49 37.55.59.224  
02.07.2013 18:59 37.55.59.224  
02.07.2013 19:21 85.26.184.203 Вип ангел 654321
02.07.2013 19:49 95.86.186.170 Неизвестный 463297
02.07.2013 19:50 37.55.59.224  
02.07.2013 19:51 37.55.59.224  
02.07.2013 19:51 37.55.59.224  
02.07.2013 19:51 37.55.59.224  
02.07.2013 19:52 37.55.59.224  
02.07.2013 19:53 37.55.59.224  
2013-07-02 19:58 95.111.217.109 24140 => АК-47 User stuck in battle 21185.
02.07.2013 20:01 93.180.199.186 Vi-Fi pfqrfjlyjzqrf
02.07.2013 20:02 37.55.59.224  
02.07.2013 20:04 37.55.59.224  
02.07.2013 20:04 46.211.227.202 Strann1k paul2703
2013-07-02 20:27 195.246.102.49 4479582 => Dalisha User stuck in battle 21489.
02.07.2013 21:00 37.233.26.143 Миджай 123123
02.07.2013 21:00 37.233.26.143 Midjai 111111
02.07.2013 21:01 37.233.26.143 Midjai 123123
2013-07-02 21:38 93.79.74.130 4479055 => valyrik User stuck in battle 22341.
2013-07-02 21:38 195.246.102.52 4479582 => Dalisha User stuck in battle 22341.
02.07.2013 22:01 46.22.224.157 bez pridel cadrovi6242030
02.07.2013 23:07 195.246.102.52 dalisha nigina1001\\
02.07.2013 23:14 46.22.224.157 bez pridel quli9402761
02.07.2013 23:16 213.87.130.174  
03.07.2013 00:18 217.19.208.102 БПАН qaz123
03.07.2013 00:19 46.22.227.187 demona asdwa
03.07.2013 00:31 178.72.183.190 Логин 
03.07.2013 00:33 176.14.179.197 ьььььььььььььь 123456
03.07.2013 00:33 195.246.102.52 dalish nigina1001
03.07.2013 00:33 176.14.179.197 ьььььььььььььь 123456
03.07.2013 00:35 176.14.179.197 хз хз хз 123456
03.07.2013 00:39 178.122.101.239 double trouble 1503ande
03.07.2013 00:41 178.72.183.190 святой ангел d
03.07.2013 00:46 83.149.9.239 Nagora 65504
03.07.2013 00:46 83.149.9.239 Nagora 6550427
03.07.2013 00:55 195.246.102.56  
03.07.2013 00:56 109.251.74.29 makskare melkiy
03.07.2013 00:56 109.251.74.29 makskare melkiy1993
03.07.2013 00:58 109.251.74.29 makskare melkiy
03.07.2013 01:00 94.243.127.222 SoulVoice 
03.07.2013 01:02 94.153.19.28 elti rpz6798
03.07.2013 01:02 94.243.127.222 SoulVoice 
03.07.2013 01:36 81.200.21.47 The Anti-Christ NUMBER
03.07.2013 01:37 81.200.21.47 The Anti-Christ NUMBER
03.07.2013 01:37 81.200.21.47 The Anti-Christ NUMBER
03.07.2013 01:39 81.200.21.47 The Anti-Christ b76f565b37
03.07.2013 01:39 81.200.21.47 The Anti-Christ b76f565b37
03.07.2013 01:39 81.200.21.47 The Anti-Christ b76f565b37
2013-07-03 09:28 195.246.102.49 4479530 => Amidamaru User stuck in battle 25842.
03.07.2013 09:45 213.87.132.213 шахиризада 741949йй
03.07.2013 09:45 213.87.132.213 шахиризада 741949
03.07.2013 10:15 188.32.188.198 Gud in tak qzwxecrv12
2013-07-03 10:28 195.246.102.57 4479582 => Dalisha User stuck in battle 26351.
2013-07-03 10:51 91.218.170.87 4478018 => Черноглазая User stuck in battle 26633.
2013-07-03 11:48 178.72.183.190 4476958 => Святой АНГЕЛ User stuck in battle 27431.
03.07.2013 13:06 37.114.166.9 invader йцук123ъ
2013-07-03 13:17 78.111.56.79 4478019 => ZEPKO User stuck in battle 28606.
03.07.2013 13:26 94.180.124.42 Кровавый Вано шашка11
2013-07-03 13:40 195.246.102.57 4479582 => Dalisha User stuck in battle 28834.
2013-07-03 13:46 91.218.170.87 4478018 => Черноглазая User stuck in battle 28863.
2013-07-03 13:46 93.212.189.134 24239 => Baltozar User stuck in battle 28863.
2013-07-03 13:57 93.212.189.134 24239 => Baltozar User stuck in battle 28937.
03.07.2013 14:19 93.183.202.130 Alistim drapus1
03.07.2013 14:19 93.183.202.130 Alistim drapus6
03.07.2013 14:20 93.183.202.130 alistim drapus1
03.07.2013 14:20 93.183.202.130 alistim drapus6
03.07.2013 14:28 93.79.74.130 valyrik 322118]
03.07.2013 14:28 93.79.74.130 valy 
03.07.2013 14:28 93.79.74.130 uigoo 
03.07.2013 14:28 93.79.74.130  
03.07.2013 14:30 94.20.249.104 Логин 
2013-07-03 14:53 178.122.101.239 4479618 => Double Trouble User stuck in battle 29489.
03.07.2013 15:56 62.217.155.213 reddevil salamsamir7
03.07.2013 15:56 62.217.155.213 reddevil salamsamir7
03.07.2013 15:56 62.217.155.213 reddevil salamsamir
2013-07-03 16:02 178.122.101.239 4479618 => Double Trouble User stuck in battle 30160.
03.07.2013 16:02 188.231.180.160 marcoff zxcvbnm
2013-07-03 16:16 91.231.255.225 4479535 => Дадаи Рустамчон User stuck in battle 30242.
03.07.2013 16:18 195.246.102.58 amidamaru maserati
03.07.2013 16:39 37.61.117.64 extra hold vaz2107
2013-07-03 16:47 195.246.102.57 4479560 => Земляной User stuck in battle 30886.
2013-07-03 16:48 195.246.102.57 4479530 => Amidamaru User stuck in battle 30905.
2013-07-03 16:49 195.246.102.57 4479560 => Земляной User stuck in battle 30925.
2013-07-03 16:51 195.246.102.57 4479560 => Земляной User stuck in battle 30953.
2013-07-03 17:03 31.170.34.63 4478193 => Gannicus User stuck in battle 31130.
03.07.2013 18:20 37.55.227.143  
2013-07-03 18:44 91.226.14.202 4479030 => viktoriya User stuck in battle 32267.
2013-07-03 18:59 95.86.164.192 4479522 => ХоМяК с ПасТоЙ БлЭнД а МэД User stuck in battle 32345.
03.07.2013 19:07 37.61.91.38 каталонец123321 
03.07.2013 19:07 37.61.91.38 каталоне 123321
03.07.2013 19:15 37.55.227.143  
03.07.2013 19:31 37.55.227.143  
03.07.2013 20:27 66.119.41.34  
2013-07-03 20:38 195.246.102.54 4479582 => Dalisha User stuck in battle 33357.
03.07.2013 20:56 37.55.227.143 злюка вфы000
03.07.2013 21:20 62.217.155.213 reddevil salamsmir
03.07.2013 21:20 62.217.155.213 reddevil salamsamir7
2013-07-03 21:36 94.20.249.104 4479525 => Невидим User stuck in battle 34176.
2013-07-03 21:46 95.86.164.192 4479522 => ХоМяК с ПасТоЙ БлЭнД а МэД User stuck in battle 34383.
2013-07-03 22:02 195.246.102.53 4479530 => Amidamaru User stuck in battle 34481.
03.07.2013 22:06 91.221.65.7 Angel Smerti box5623
03.07.2013 22:12 37.190.50.10 РІРµР¶Р»РёРІС‹Р№_СЃРЅР°Р№РїРµСЂ 9759023
03.07.2013 22:41 37.52.23.212  
03.07.2013 22:42 37.52.23.212  
2013-07-03 22:53 5.44.39.182 4476651 => favorit User stuck in battle 35117.
03.07.2013 22:54 93.116.33.211 Логин 
03.07.2013 22:58 62.221.56.35  
03.07.2013 23:14 37.52.23.212  
03.07.2013 23:17 37.52.23.212  
2013-07-03 23:42 95.86.164.192 4479522 => ХоМяК с ПасТоЙ БлЭнД а МэД User stuck in battle 35435.
04.07.2013 03:55 37.114.166.9 invader йцук1233
04.07.2013 07:39 109.68.237.15 Ремм дигга 507733
2013-07-04 09:09 91.235.38.143 4478018 => Черноглазая User stuck in battle 37240.
04.07.2013 10:33 94.25.229.96 СУПЕР БОРИС NWZK2BRN
2013-07-04 11:34 195.246.102.55 4479560 => Земляной User stuck in battle 38427.
04.07.2013 12:21 195.72.158.196 Мудрец funtik1986
04.07.2013 12:51 217.19.208.106 Логин 
2013-07-04 12:55 91.235.38.143 4478018 => Черноглазая User stuck in battle 39367.
2013-07-04 13:22 188.227.212.178 4478019 => ZEPKO User stuck in battle 39426.
04.07.2013 13:56 46.23.110.12 BLACK_ANGEL qaraxan
2013-07-04 14:29 188.227.212.178 4478019 => ZEPKO User stuck in battle 40076.
2013-07-04 14:29 93.183.236.125 4478969 => Jojo User stuck in battle 40081.
04.07.2013 14:38 91.231.255.225 dalisha nigina0110
2013-07-04 14:59 91.231.255.225 4479582 => Dalisha User stuck in battle 40242.
04.07.2013 15:37 31.170.36.175 x Дельфина х mama7710
04.07.2013 15:58 5.248.116.197 серафим polkiu091001
04.07.2013 16:27 213.154.23.164 Осторожно Йераз atanpeyser745965
04.07.2013 16:55 157.55.36.36  
04.07.2013 16:57 109.185.120.184 Шпили Уили 159753-
04.07.2013 16:58 109.185.120.184 Шпили Уили 159753
04.07.2013 16:59 109.185.120.184 Шпилли Уилли 159753
04.07.2013 16:59 109.185.120.184 Шпили Уилли 159753-
04.07.2013 17:21 95.68.64.198 tactics 1q2w3e4r
04.07.2013 17:21 95.68.64.198 tactics qwerty
04.07.2013 17:33 62.221.56.35  
04.07.2013 17:34 62.221.56.35  
04.07.2013 17:34 62.221.56.35  
04.07.2013 17:36 62.221.56.35  
04.07.2013 17:37 62.221.56.35  
04.07.2013 17:37 62.221.56.35  
2013-07-04 18:08 91.231.255.225 4479535 => Дадаи Рустамчон User stuck in battle 42596.
2013-07-04 18:08 178.150.209.83 4476298 => Грюндик User stuck in battle 42596.
2013-07-04 18:15 62.217.155.213 4479673 => REDDEVIL User stuck in battle 42664.
2013-07-04 18:19 178.150.209.83 4476298 => Грюндик User stuck in battle 42683.
2013-07-04 18:21 178.150.209.83 4476298 => Грюндик User stuck in battle 42729.
2013-07-04 18:22 178.150.209.83 4476298 => Грюндик User stuck in battle 42738.
04.07.2013 18:25 91.231.255.225 dalish nigina1001
2013-07-04 18:33 192.166.102.5 4479571 => Люкен User stuck in battle 42835.
2013-07-04 18:45 188.227.212.178 4478019 => ZEPKO User stuck in battle 42724.
2013-07-04 18:46 188.18.50.145 4478193 => Gannicus User stuck in battle 43004.
2013-07-04 18:51 88.235.74.102 4479524 => Tarman Faraon User stuck in battle 43050.
2013-07-04 18:52 88.235.74.102 4479524 => Tarman Faraon User stuck in battle 43071.
2013-07-04 18:52 77.122.157.95 4478225 => Непобедимый User stuck in battle 43071.
04.07.2013 18:55 188.227.45.44 Dartc t5t5r4
04.07.2013 18:56 178.67.24.230 Сплэш вбг 159753456
04.07.2013 18:56 178.67.24.230 Сплэш вбг 159753456
04.07.2013 18:56 178.67.24.230 Сплэш вбг 6986908
04.07.2013 18:56 178.67.24.230 Сплэш вбг 159753456вти
04.07.2013 18:56 178.67.24.230 Сплэш вбг 6986908вти
04.07.2013 18:57 178.67.24.230 Сплэш вбг 159753456dnb
04.07.2013 18:57 178.67.24.230 Сплэш вбг 6986908dnb
04.07.2013 19:02 178.67.24.230 mobi_92@mail.ru 6986908
04.07.2013 19:03 178.67.24.230 mobi_92@mail.ru 6986908
04.07.2013 19:03 178.67.24.230 mobi_92@mail.ru 159753456
04.07.2013 19:03 178.67.24.230 Сплэш вбг 159753456
04.07.2013 19:03 178.67.24.230 Сплэш вбг 159753вти
2013-07-04 19:08 109.68.234.14 4477018 => ™BOSS™ User stuck in battle 43163.
2013-07-04 19:11 5.248.116.197 4478374 => Серафим User stuck in battle 43166.
04.07.2013 19:14 95.79.131.213 магмар w234254
04.07.2013 19:15 95.79.131.213 магмар w234254
2013-07-04 19:16 91.231.255.225 4479582 => Dalisha User stuck in battle 43200.
2013-07-04 19:20 178.72.183.190 4476958 => Святой АНГЕЛ User stuck in battle 43229.
2013-07-04 19:21 213.154.16.184 4478408 => каталонец User stuck in battle 43232.
04.07.2013 19:22 195.140.229.84 маська в бикини Пона12
2013-07-04 19:23 213.154.16.184 4478408 => каталонец User stuck in battle 43241.
2013-07-04 19:23 91.231.255.225 4479582 => Dalisha User stuck in battle 43237.
2013-07-04 19:32 178.122.101.239 4479607 => Captain User stuck in battle 43287.
04.07.2013 20:08 193.161.14.164 Добрый яя333яя
2013-07-04 20:16 178.122.101.239 4479607 => Captain User stuck in battle 43710.
2013-07-04 20:29 37.57.220.119 4479556 => BILBA-SUMKIN User stuck in battle 43835.
04.07.2013 20:44 37.194.196.95 neoman papugaq123
2013-07-04 20:58 37.57.220.119 4479556 => BILBA-SUMKIN User stuck in battle 44166.
04.07.2013 21:41 81.24.84.19 optimus-praym pako199213
04.07.2013 21:41 81.24.84.19 optimus-praym pako199213
04.07.2013 21:41 81.24.84.19 optimus-praym pako199213
04.07.2013 21:41 81.24.84.19 optimus-praym pako1992
04.07.2013 21:42 188.134.60.105 Эльронд 123456
2013-07-04 21:53 91.235.38.143 4478088 => Крутой Батя User stuck in battle 44178.
2013-07-04 22:07 91.235.38.143 4478018 => Черноглазая User stuck in battle 44767.
2013-07-04 22:12 91.235.38.143 4479582 => Dalisha User stuck in battle 44818.
2013-07-04 22:21 91.235.38.143 4478018 => Черноглазая User stuck in battle 44907.
04.07.2013 22:42 178.122.101.239 ouble trouble 1503and
04.07.2013 22:51 178.67.24.230 Сплэш вбг 159753456
04.07.2013 22:51 178.67.24.230 Сплэш вбг 6986908
04.07.2013 22:51 178.67.24.230 Сплэшвбг 159753456
2013-07-04 22:53 91.124.131.157 4477531 => Стилет User stuck in battle 45168.
04.07.2013 22:57 176.8.88.135 yurec1989 123kdwhtkm
04.07.2013 23:01 46.247.164.13  
04.07.2013 23:57 62.217.155.213 elik elikrex
04.07.2013 23:58 62.217.155.213 blackdevil elikrex123
04.07.2013 23:58 195.58.236.66  
04.07.2013 23:58 62.217.155.213 blackdevil elikrex123
04.07.2013 23:58 62.217.155.213 blackdevil elikrex
2013-07-05 00:01 178.122.101.239 4479607 => Captain User stuck in battle 45595.
2013-07-05 00:01 178.72.183.190 4476958 => Святой АНГЕЛ User stuck in battle 45589.
2013-07-05 00:18 195.246.102.51 4479582 => Dalisha User stuck in battle 45756.
2013-07-05 00:45 94.19.41.150 4479260 => Фанат User stuck in battle 46042.
05.07.2013 00:56 94.19.41.150 Фанат qweasdzxcx
05.07.2013 01:04 46.211.120.225 bugaina vbheafr66
05.07.2013 01:18 188.115.167.99 oktanius slavik2
05.07.2013 06:32 85.132.10.1 geologist 55551552
05.07.2013 08:18 37.114.166.9 Strann1k qweqwe
05.07.2013 08:30 77.50.223.13 l 
05.07.2013 08:41 178.76.55.80 Кирпич_С_неБа лфьфд72352801
05.07.2013 11:00 37.61.63.53 осторожна йераз can275
05.07.2013 11:34 95.27.221.203 Танцующая с Волками 110609
05.07.2013 11:34 95.27.221.203 Танцующая с Воками 080602
05.07.2013 11:34 95.27.221.203 Танцующая с Воками 080602
05.07.2013 11:35 95.27.221.203 Танцующая с Волками 180681
05.07.2013 12:54 95.182.86.114  
2013-07-05 16:49 91.235.36.53 4478088 => Крутой Батя User stuck in battle 52692.
05.07.2013 17:17 130.185.4.199 SeDJey pfqrfjlyjzqrf1989]
05.07.2013 17:59 46.19.96.134 Ars-o xe24rxf4u8
2013-07-05 18:05 37.212.64.176 4479607 => Captain User stuck in battle 53655.
2013-07-05 18:14 195.246.102.58 4479560 => Земляной User stuck in battle 53708.
05.07.2013 18:18 176.14.97.38 Логин 
05.07.2013 19:03 91.231.255.225  
05.07.2013 19:12 176.36.164.183 Link_Ex 
05.07.2013 19:49 62.221.56.35  
05.07.2013 20:23 91.235.36.53 крутой бтя ramzes4251090
05.07.2013 20:31 94.19.41.150  
2013-07-05 20:32 95.86.173.6 4479522 => ХоМяК с ПасТоЙ БлЭнД а МэД User stuck in battle 54950.
2013-07-05 21:30 91.235.36.53 4478088 => Крутой Батя User stuck in battle 55423.
2013-07-05 21:40 5.134.63.2 4478019 => ZEPKO User stuck in battle 55546.
05.07.2013 23:16 46.211.183.249 Heath Ledger nanoprotek
05.07.2013 23:33 95.179.51.58 дея торис irjkmyfz10
05.07.2013 23:33 95.179.51.58 дея торис irjkmyfz10
05.07.2013 23:44 178.94.104.41 Вредность 123456
05.07.2013 23:45 178.94.104.41 Вредность 250196
05.07.2013 23:45 178.94.104.41 Вредность 160947
05.07.2013 23:45 178.94.104.41 Вредность 123456
05.07.2013 23:45 178.94.104.41 Вредность dtkfcbgtl
05.07.2013 23:52 178.94.104.41 Вредность 123456
05.07.2013 23:58 178.94.104.41 Вредность 16091947
05.07.2013 23:58 178.94.104.41 Вредность 250196
05.07.2013 23:59 178.94.104.41 Вредность 25011996
06.07.2013 00:00 178.94.104.41 Вредность 123456
06.07.2013 00:00 178.94.104.41 Вредность ytbpdtcnyjcnm
06.07.2013 00:12 178.66.54.225 Бунтарка Проль повторно
2013-07-06 01:45 37.57.220.119 4479556 => BILBA-SUMKIN User stuck in battle 58404.
2013-07-06 01:50 5.134.56.47 4479545 => Привет из Баку User stuck in battle 58470.
2013-07-06 01:52 5.134.56.47 4479545 => Привет из Баку User stuck in battle 58488.
06.07.2013 03:42 93.72.121.75 Ермун SASASA
2013-07-06 09:55 176.113.142.210 4478018 => Черноглазая User stuck in battle 59990.
06.07.2013 11:13 46.247.173.38  
06.07.2013 11:46 91.190.115.250 smert 
06.07.2013 11:47 87.255.14.112 Freakazoid Акшлфящшв
06.07.2013 12:08 176.8.88.135 yurec1989 123dekrfy
06.07.2013 12:19 91.231.255.225 Логин ramzes4251090
06.07.2013 12:20 62.221.56.35  
06.07.2013 13:09 37.19.217.85 SeDJey pfqrfjlyjzqrf
06.07.2013 13:10 95.132.159.250 WarStyle Лшлщ20582
2013-07-06 13:21 195.246.102.49 4479582 => Dalisha User stuck in battle 62187.
06.07.2013 13:33 77.122.161.41 tik-tak-q@mail.ru dfqgth66
06.07.2013 13:33 77.122.161.41 toxa bk dfqgth66
06.07.2013 13:38 195.225.145.16 Иван Владимирович вася21
06.07.2013 13:38 195.225.145.16 Кластер ваня21
06.07.2013 13:39 195.225.145.16 Кластер вася21
06.07.2013 13:39 195.225.145.16 Калигула вася21
2013-07-06 13:47 37.190.50.10 4479160 => Вежливый_Снайпер User stuck in battle 62456.
06.07.2013 14:08 37.114.166.9 invader qwer123
2013-07-06 14:26 93.180.196.77 24140 => АК-47 User stuck in battle 188.
2013-07-06 14:28 93.180.196.77 24140 => АК-47 User stuck in battle 194.
06.07.2013 14:41 83.220.239.39 gurman sbs31248
06.07.2013 14:45 87.255.14.112 Freakazoid Frikaoid
2013-07-06 14:46 46.118.118.132 4478569 => азмандус User stuck in battle 457.
2013-07-06 15:14 195.246.102.48 4479582 => Dalisha User stuck in battle 822.
06.07.2013 15:37 94.179.247.78 Логин 
06.07.2013 15:49 188.255.80.25 шмоль 1234567
06.07.2013 16:06 94.179.247.78  
2013-07-06 16:11 95.153.118.63 4479247 => Brain User stuck in battle 1443.
2013-07-06 16:11 195.246.102.48 4479582 => Dalisha User stuck in battle 1422.
2013-07-06 16:34 46.211.127.234 24506 => bugaina User stuck in battle 1784.
2013-07-06 17:46 91.124.205.155 24184 => дима User stuck in battle 2631.
2013-07-06 17:46 91.231.255.225 4479535 => Дадаи Рустамчон User stuck in battle 2631.
2013-07-06 17:56 5.134.59.67 4478019 => ZEPKO User stuck in battle 2739.
06.07.2013 18:07 176.113.142.210 черноглазая kompas2246565
06.07.2013 18:08 176.113.142.210 черноглазая лщьзфы2246565
2013-07-06 19:24 195.246.102.54 4479582 => Dalisha User stuck in battle 3861.
06.07.2013 19:28 195.246.102.53 землянойqwerty1 
2013-07-06 19:50 195.246.102.54 4479582 => Dalisha User stuck in battle 4141.
06.07.2013 20:03 46.22.230.174 bez pridel quli9402761
2013-07-06 20:23 95.133.86.235 24184 => дима User stuck in battle 4411.
2013-07-06 20:23 176.113.142.210 4478018 => Черноглазая User stuck in battle 4411.
2013-07-06 21:49 95.86.177.57 4479522 => ХоМяК с ПасТоЙ БлЭнД а МэД User stuck in battle 4782.
2013-07-06 21:53 176.113.142.210 4478018 => Черноглазая User stuck in battle 5662.
2013-07-06 22:18 5.134.59.67 4478019 => ZEPKO User stuck in battle 5965.
2013-07-06 22:22 5.134.59.67 4478019 => ZEPKO User stuck in battle 6010.
2013-07-06 22:25 37.57.220.119 4479556 => BILBA-SUMKIN User stuck in battle 6032.
2013-07-06 22:45 176.113.142.210 4478088 => Крутой Батя User stuck in battle 5738.
2013-07-06 23:04 5.134.59.67 4478019 => ZEPKO User stuck in battle 6578.
06.07.2013 23:10 46.247.160.92  
2013-07-06 23:20 46.23.107.44 4479685 => BLACK_ANGEL User stuck in battle 6764.
2013-07-06 23:24 178.72.183.190 4476958 => УкУрИнАя ЧеБуРаШкА User stuck in battle 6905.
2013-07-06 23:25 109.68.236.20 4477018 => ™BOSS™ User stuck in battle 6904.
06.07.2013 23:55 46.247.189.68  
2013-07-07 00:16 5.134.59.67 4478019 => ZEPKO User stuck in battle 7151.
07.07.2013 00:30 95.27.164.247 Bossovskiy nuttertools
07.07.2013 00:49 78.56.132.142 Сияна qwert1
07.07.2013 01:02 91.234.196.34 sistemxaos vasya1988
07.07.2013 01:17 188.253.248.76 korok_is_baku orik
07.07.2013 01:17 188.253.248.76 korok_is_baku orik
07.07.2013 01:17 188.253.248.76 korol_is_baku orik
07.07.2013 01:21 188.253.248.76 korok_is_baku orik9562136
07.07.2013 02:22 188.253.136.89 аталонец 123321
07.07.2013 04:03 46.118.118.132 змандус 1qa2ws3ed4rf
07.07.2013 04:07 46.118.118.132  
07.07.2013 04:07 46.118.118.132  
07.07.2013 07:16 176.113.141.220 черноглазая компас2246565
07.07.2013 10:13 194.213.104.5 омут я 28119130
07.07.2013 10:13 194.213.104.5 омут я гоут84
07.07.2013 10:13 194.213.104.5 омут я гоут25121987
07.07.2013 10:14 194.213.104.5 омут я ujen25121987
07.07.2013 10:14 194.213.104.5 омут я ujen84
07.07.2013 10:14 194.213.104.5 омут я 25121987
2013-07-07 11:25 176.113.141.220 4478088 => Крутой Батя User stuck in battle 10535.
07.07.2013 12:29 176.101.5.19 metrix 522088
2013-07-07 12:42 195.246.102.58 4479582 => Dalisha User stuck in battle 11463.
2013-07-07 12:53 195.246.102.58 4479582 => Dalisha User stuck in battle 11568.
2013-07-07 13:14 95.133.115.2 24184 => дима User stuck in battle 11752.
2013-07-07 13:30 95.133.115.2 24184 => дима User stuck in battle 11800.
2013-07-07 13:52 178.72.183.190 4476958 => УкУрИнАя ЧеБуРаШкА User stuck in battle 11878.
2013-07-07 13:55 91.231.255.225 4479535 => Дадаи Рустамчон User stuck in battle 11801.
07.07.2013 14:01 37.55.24.128 bachelor rezident3
2013-07-07 14:29 193.161.14.168 24248 => Добрый User stuck in battle 12525.
2013-07-07 15:06 91.231.255.225 4479535 => Дадаи Рустамчон User stuck in battle 13100.
07.07.2013 15:26 93.183.236.70 Jojo 
2013-07-07 15:29 91.124.105.123 4477531 => Стилет User stuck in battle 13354.
07.07.2013 16:16 109.237.124.46 savetski quli9402761
2013-07-07 16:26 93.188.154.54 4479160 => Вежливый_Снайпер User stuck in battle 14004.
07.07.2013 16:34 5.140.27.47 Gannicus eqfwgq4e
07.07.2013 16:40 194.213.104.5 молчание ujen1984
2013-07-07 17:17 178.72.183.190 4476958 => УкУрИнАя ЧеБуРаШкА User stuck in battle 14566.
07.07.2013 17:38 93.79.74.130 valyrik 322117
07.07.2013 17:38 93.79.74.130 fgd 
07.07.2013 17:38 93.79.74.130  
07.07.2013 17:38 93.79.74.130  
2013-07-07 17:57 86.100.76.131 4479060 => Валькирия User stuck in battle 15141.
2013-07-07 18:03 178.76.39.108 24753 => Тот_самыЙ User stuck in battle 15272.
2013-07-07 18:09 178.76.39.108 24753 => Тот_самыЙ User stuck in battle 15267.
2013-07-07 18:18 95.86.164.240 4479522 => ТеТ-а-ТеТ User stuck in battle 15444.
2013-07-07 18:18 5.44.39.103 4476651 => favorit User stuck in battle 15444.
2013-07-07 18:29 95.86.164.240 4479522 => ТеТ-а-ТеТ User stuck in battle 15495.
07.07.2013 18:54 78.111.56.157 zepko emrah1001
2013-07-07 18:56 5.44.39.103 4476651 => favorit User stuck in battle 15749.
2013-07-07 19:00 178.72.183.190 4476958 => УкУрИнАя ЧеБуРаШкА User stuck in battle 15839.
07.07.2013 19:09 37.114.144.194 staff anar32
07.07.2013 19:09 37.114.144.194 Старик anar32
07.07.2013 19:10 37.114.144.194 Старик фтфк32
2013-07-07 19:10 217.19.208.108 4479653 => BPAN User stuck in battle 15919.
2013-07-07 19:16 195.246.102.53 4479582 => Dalisha User stuck in battle 15931.
2013-07-07 19:24 91.200.217.80 4478018 => Черноглазая User stuck in battle 15934.
07.07.2013 20:24 212.142.69.87 last04ka 1980rascxzevg1
07.07.2013 20:24 212.142.69.87 last04ka 1980rascxzevg1
07.07.2013 20:25 212.142.69.87 last04ka 1980rasdcxzevg1
07.07.2013 20:25 212.142.69.87 last04ka 1980rasdcxzevg1
07.07.2013 20:26 93.116.33.211 Логин 
07.07.2013 20:28 212.142.69.87 last04ka 1980rasdcxzevg1
07.07.2013 20:30 212.142.69.87 last04ka 1980rasdcxzevg1
07.07.2013 20:30 212.142.69.87 last04ka 1980кфывсчяум1
07.07.2013 20:33 212.142.69.87 last04ka 1980кфяумп1
07.07.2013 20:33 212.142.69.87 last04ka 1980кфяумп1
07.07.2013 20:47 5.29.44.45 КФМШТ 11яяййфф
07.07.2013 21:05 188.17.18.7 Gannicus eqfwgq4e
07.07.2013 21:47 62.217.155.213 reddevil salamsmair
2013-07-07 22:09 109.68.234.7 4478439 => AntiAdmin User stuck in battle 17423.
07.07.2013 22:09 188.17.18.7 Gannicus eqfwgq4e
2013-07-07 22:14 109.68.234.7 4478439 => AntiAdmin User stuck in battle 17464.
07.07.2013 22:40 176.214.17.162 agressors 290223022
07.07.2013 22:40 176.214.17.162 agressors gidra2008
07.07.2013 22:59 178.94.29.230 Вредность ytbpdtcnyjcnm
07.07.2013 23:17 5.44.39.175 namura 258000
07.07.2013 23:23 89.149.114.167 decebal dec123
07.07.2013 23:24 89.149.114.167 decebal decebal123
07.07.2013 23:24 89.149.114.167 asus asus123
07.07.2013 23:37 5.44.39.175 ceko maksud55
07.07.2013 23:37 5.44.39.175 ceko 258000
07.07.2013 23:37 5.44.39.175 miskapriz maksud55
07.07.2013 23:37 5.44.39.175 miskapriz 258000
07.07.2013 23:37 5.44.39.175 miskapriz maksud55
07.07.2013 23:37 5.44.39.175 mutitel maksud55
07.07.2013 23:38 5.44.39.175 mutitel 258000
07.07.2013 23:39 5.134.60.26 zaroz nokia8100
2013-07-07 23:51 95.86.164.240 4479522 => ТеТ-а-ТеТ User stuck in battle 18722.
2013-07-07 23:58 95.86.164.240 4479522 => ТеТ-а-ТеТ User stuck in battle 18856.
07.07.2013 23:59 176.8.88.135 yurec1989 Удачно переданы 300 кр к персонажу geologist
2013-07-08 00:05 178.72.183.190 4476958 => УкУрИнАя ЧеБуРаШкА User stuck in battle 18965.
2013-07-08 00:59 95.86.164.240 4479522 => ТеТ-а-ТеТ User stuck in battle 19451.
2013-07-08 01:01 93.183.236.125 4478969 => Jojo User stuck in battle 19477.
2013-07-08 01:02 78.111.56.157 4478019 => ZEPKO User stuck in battle 19483.
2013-07-08 01:03 78.111.56.157 4478019 => ZEPKO User stuck in battle 19511.
2013-07-08 01:06 95.86.164.240 4479522 => ТеТ-а-ТеТ User stuck in battle 19536.
2013-07-08 01:09 78.111.56.157 4478019 => ZEPKO User stuck in battle 19554.
2013-07-08 01:38 95.86.164.240 4479522 => ТеТ-а-ТеТ User stuck in battle 19692.
2013-07-08 01:47 178.216.16.138 24796 => Шейник User stuck in battle 19753.
2013-07-08 02:07 95.86.164.240 4479522 => ТеТ-а-ТеТ User stuck in battle 19794.
08.07.2013 07:05 178.94.29.230 Вредность ytbpdtcnyjcnm
08.07.2013 07:55 94.20.29.16 Боевулф salam555
08.07.2013 08:41 85.64.27.89 Ялегионер iditet025
08.07.2013 08:41 85.64.27.89 Ялегионер 500820
08.07.2013 09:15 31.170.35.222 Gannicus eqfwgq4e
08.07.2013 09:26 94.25.229.103 СУПЕР БОРИС NWZK2BRN
08.07.2013 09:42 87.255.14.112 Freakazoid Акшлфящшв
08.07.2013 15:25 37.61.84.157 аталонец 123321
08.07.2013 15:49 37.114.166.201 Ц а р ь anar32
2013-07-08 16:46 178.237.64.8 4478019 => ZEPKO User stuck in battle 25316.
08.07.2013 17:04 195.246.102.60 bestcombats.net 
2013-07-08 17:18 193.238.96.46 4478969 => Jojo User stuck in battle 25651.
2013-07-08 17:20 178.237.64.8 4478019 => ZEPKO User stuck in battle 25670.
08.07.2013 18:17 46.19.96.134 x-X-x 
08.07.2013 19:44 178.94.24.217 Вредность ytbpdtcnyjcnm
2013-07-08 20:04 95.182.83.150 4476576 => Bestlynx User stuck in battle 26816.
08.07.2013 20:20 95.111.229.193 АК-47 zelya90
2013-07-08 20:36 91.235.38.177 4478018 => Черноглазая User stuck in battle 26859.
2013-07-08 20:55 94.19.41.150 4479260 => Фанат User stuck in battle 26955.
08.07.2013 21:33 178.215.171.40  
08.07.2013 21:38 86.100.76.131 Логин 
08.07.2013 22:11 46.203.232.27 минерал ыщтн517722
2013-07-08 22:57 5.134.56.156 4479545 => Привет из Баку User stuck in battle 28127.
2013-07-08 23:41 195.246.102.60 4479758 => Любимая User stuck in battle 28569.
08.07.2013 23:44 87.255.14.112 Freakazoid Акшлфящшв
2013-07-08 23:51 195.246.102.60 4479758 => Любимая User stuck in battle 28617.
2013-07-09 00:09 85.26.183.111 4479229 => Прототип User stuck in battle 28821.
09.07.2013 00:16 109.162.7.205 Per aspera ad astra romantikl
2013-07-09 00:22 94.19.41.150 4479260 => Фанат User stuck in battle 28831.
09.07.2013 00:29 89.147.247.16 Musluman 7063806
2013-07-09 00:59 212.93.100.4 4477750 => тихий маг User stuck in battle 29250.
09.07.2013 04:50 37.128.201.249 reddevil lamsamir
09.07.2013 08:32 46.242.22.214 РАКОТ ВОССТАВШИЙ 1597534646
09.07.2013 08:32 46.242.22.214 РАКОТ ВОССТАВШИЙ 1597534646
09.07.2013 09:18 46.23.107.28 b 
09.07.2013 11:32 178.94.38.108 StatiX dalex137925
09.07.2013 11:36 188.253.158.173 HADES vaz2107
09.07.2013 11:48 79.170.191.21 Боец 1 
09.07.2013 12:18 109.188.126.252  
09.07.2013 12:28 91.218.171.123 черноглазая компас2246565
09.07.2013 12:44 188.255.80.25  
09.07.2013 13:19 78.25.120.141 smert 
2013-07-09 13:37 91.231.255.225 4478088 => Крутой Батя User stuck in battle 33239.
2013-07-09 13:37 91.200.218.221 4478018 => Черноглазая User stuck in battle 33239.
09.07.2013 13:46 109.68.236.12 AntiAdmin ruzik1985
2013-07-09 13:56 37.61.105.25 24986 => C_C_C_P User stuck in battle 33467.
2013-07-09 14:02 37.61.105.25 24986 => C_C_C_P User stuck in battle 33548.
09.07.2013 14:18 31.204.100.170 Загадочный QwE0667135412$$
09.07.2013 14:32 178.72.183.190 укуриная чебруашка aaz102
2013-07-09 15:18 93.116.33.211 4477659 => Шпилли Уилли User stuck in battle 34373.
09.07.2013 15:21 91.231.255.225 черноглазая компас2246565
2013-07-09 15:28 213.226.141.221 4476320 => joker40 User stuck in battle 34534.
09.07.2013 15:30 83.221.203.218  
09.07.2013 15:34 91.231.255.225 круиой батя ramzes4251090
09.07.2013 15:39 93.116.83.59 RUSSUR laskovii77
09.07.2013 15:39 178.122.213.245 double troouble 1503and
09.07.2013 15:43 195.246.102.58 amidamaru ben1010
09.07.2013 16:31 188.255.80.25 Логин 
09.07.2013 16:55 109.68.234.10 InvadeR root
09.07.2013 16:55 109.68.234.10 InvadeR support@oldcombats.be
09.07.2013 16:56 109.68.234.10 InvadeR 12345
09.07.2013 18:29 46.242.22.214 РАКОТ ВОССТАВШИЙ 1597534646
09.07.2013 19:12 46.242.22.214 РАКОТ ВОССТАВШИЙ 1597534646
09.07.2013 19:12 46.242.22.214 РАКОТ ВОССТАВШИЙ 1597534646
09.07.2013 19:12 46.242.22.214 РАКОТ ВОССТАВШИЙ krylov1212
09.07.2013 19:12 46.242.22.214 РАКОТ ВОССТАВШИЙ krylov12
09.07.2013 20:06 195.246.102.57 земляной qwerty2
2013-07-09 20:13 94.19.41.150 4479260 => Фанат User stuck in battle 37955.
2013-07-09 20:29 178.237.64.5 4478019 => ZEPKO User stuck in battle 38091.
09.07.2013 22:10 128.68.184.204 Танцующая на Граблях 110609
09.07.2013 23:02 95.179.79.86 Дея Торис irjkmyfz10
2013-07-09 23:10 46.23.111.106 4479685 => BLACK_ANGEL User stuck in battle 39752.
2013-07-09 23:22 62.217.155.213 4479673 => REDDEVIL User stuck in battle 39833.
09.07.2013 23:31 95.28.246.221 Falcon 52acd45179
2013-07-09 23:35 62.217.155.213 4479673 => REDDEVIL User stuck in battle 39928.
2013-07-09 23:35 212.178.0.244 4478215 => Хука User stuck in battle 39928.
10.07.2013 00:35 130.185.47.239 АК-47 zelya90
10.07.2013 00:41 5.134.61.117 kroulli nokiq81
10.07.2013 00:56 46.23.111.27 Урка 123456
2013-07-10 01:15 95.86.163.121 4479522 => ТеТ-а-ТеТ User stuck in battle 41082.
2013-07-10 01:19 130.185.47.239 24140 => Nikolaevich User stuck in battle 41003.
2013-07-10 01:29 178.237.64.5 4478019 => ZEPKO User stuck in battle 41097.
10.07.2013 07:35 178.35.241.147 КРУТОЙ МАГ 654321
10.07.2013 08:52 109.163.244.163 Kolya 18250287гыык
10.07.2013 09:39 195.246.102.59 docotr criminal ben1010
2013-07-10 10:05 178.72.183.190 4476958 => УкУрИнАя ЧеБуРаШкА User stuck in battle 43273.
10.07.2013 10:28 46.23.109.168 b 
2013-07-10 10:28 91.235.36.61 4478088 => Крутой Батя User stuck in battle 43411.
2013-07-10 11:13 195.246.102.59 4479530 => Doctor Criminal User stuck in battle 43940.
10.07.2013 11:19 217.66.152.65 rendan 4041
10.07.2013 11:26 178.94.80.208 Вредность ytghtlcrfptvjcnm
10.07.2013 12:20 95.31.110.48 Maestro Grao 384674q
2013-07-10 12:20 213.147.45.244 4479419 => Удав User stuck in battle 44506.
10.07.2013 14:04 95.153.115.23 Brain 
10.07.2013 14:08 95.153.115.23 Brain 
2013-07-10 14:34 178.72.183.190 4476958 => УкУрИнАя ЧеБуРаШкА User stuck in battle 45689.
2013-07-10 15:01 217.20.172.133 24248 => Добрый User stuck in battle 45960.
10.07.2013 15:12 86.100.76.131 Валькирия 
10.07.2013 15:12 86.100.76.131 Валькирия de19nis18
10.07.2013 15:25 150.70.97.116  
10.07.2013 15:25 150.70.75.30  
10.07.2013 16:01 86.100.76.131 Валькирия эксплорер
10.07.2013 16:13 46.242.22.214 РАКОТ ВОССТАВШИЙ 
10.07.2013 16:22 2.55.122.93 Логин n
10.07.2013 16:38 178.94.80.208 Вредность ytbpdtcnyjcnm
10.07.2013 16:54 62.217.155.213 Aze*XuliQan! islam123
10.07.2013 16:54 62.217.155.213 Aze*XuliQan! islam123
10.07.2013 16:54 62.217.155.213 Aze*XuliQan! islam123
10.07.2013 16:54 62.217.155.213 Aze*XuliQan! axmed123
10.07.2013 16:55 62.217.155.213 Aze*XuliQan! islam123
10.07.2013 17:16 62.217.155.213 Aze*XuliQan! islam123
10.07.2013 17:17 62.217.155.213 Aze*XuliQan! silam123
10.07.2013 17:17 62.217.155.213 Aze*XuliQan! sialam123
10.07.2013 17:27 91.231.253.108 Мирзоев 102030ффф
10.07.2013 17:57 213.226.141.191 jokejr40 zdrtzhm25
2013-07-10 17:59 88.234.222.76 4479524 => Tarman Faraon User stuck in battle 47259.
10.07.2013 18:08 188.19.192.26 Колян 
10.07.2013 18:09 62.221.56.35  
2013-07-10 18:16 91.235.36.103 4478088 => Крутой Батя User stuck in battle 47284.
10.07.2013 18:18 193.201.98.4 актеон 
10.07.2013 18:18 195.246.102.51 docotor criminal 
10.07.2013 18:18 195.246.102.51 docotor criminal ben1010
10.07.2013 18:20 195.246.102.51 зкмляной qwerty1
10.07.2013 18:42 95.65.3.6 посейдон 125375
10.07.2013 19:02 86.100.76.131 Валькирия Bossovskiy
10.07.2013 19:04 213.226.141.191 jokejr40 zdrtzhm25
10.07.2013 19:04 213.226.141.191 jokejr40 zdrtzhm25
10.07.2013 19:16 188.230.108.48 Дудешка Лето йцу123
10.07.2013 19:16 188.230.108.48 Дудушка Лето йцу123
10.07.2013 19:16 188.230.108.48 Дудушка Лето qwe123
2013-07-10 19:16 95.86.162.42 4479522 => ТеТ-а-ТеТ User stuck in battle 47804.
10.07.2013 19:17 188.230.108.48 Дуедушка Лето йцу123
10.07.2013 19:17 188.230.108.48 Дедушка Лето йцу123
10.07.2013 19:17 91.124.66.71 стилет 
10.07.2013 19:38 46.242.22.214 РАКОТ ВОССТАВШИЙ 
10.07.2013 19:47 188.230.108.48 Дедушка Лето йцу123
10.07.2013 20:09 46.247.187.170 удар 
10.07.2013 20:09 46.247.187.170 удар пароль
10.07.2013 20:30 37.19.158.192 император 
10.07.2013 20:30 37.19.158.192 император как деламама
10.07.2013 20:30 37.19.158.192 император privetki
10.07.2013 20:31 37.19.158.192 император rfr ltkfvfvf
2013-07-10 21:07 91.235.36.103 4478018 => Черноглазая User stuck in battle 48710.
10.07.2013 21:25 84.54.203.165 bestlynx 
10.07.2013 21:48 188.123.230.153 Шмоль 
2013-07-10 21:53 37.190.50.10 4479160 => Вежливый_Снайпер User stuck in battle 49148.
10.07.2013 22:02 188.123.230.153  
10.07.2013 22:03 188.123.230.153 Логин 
2013-07-10 22:41 178.237.79.133 4478019 => ZEPKO User stuck in battle 49712.
10.07.2013 23:04 93.116.33.211 Шпилли Уилли 
2013-07-10 23:04 178.72.183.190 4476958 => УкУрИнАя ЧеБуРаШкА User stuck in battle 49999.
10.07.2013 23:04 93.116.33.211 Шпилли Уилли 157359
2013-07-10 23:08 178.72.183.190 4476958 => УкУрИнАя ЧеБуРаШкА User stuck in battle 50027.
10.07.2013 23:14 90.133.67.207 volter 
10.07.2013 23:56 93.180.206.127 АК-47 zelya90
11.07.2013 00:03 212.142.78.2 Miheji aleksanrra
11.07.2013 00:04 212.142.78.2 Miheji aleksadra
2013-07-11 00:23 178.72.183.190 4476958 => УкУрИнАя ЧеБуРаШкА User stuck in battle 50901.
11.07.2013 01:48 93.116.83.59 RUSSUR laskovii77
11.07.2013 02:01 77.122.157.95 f 
2013-07-11 02:03 46.118.140.60 4479341 => kyzia User stuck in battle 51642.
11.07.2013 04:25 178.150.209.83 апостал тьмы 
11.07.2013 04:28 178.150.209.83 апостал тьмы 876678
11.07.2013 04:28 178.150.209.83 апостал тьмы 678876
11.07.2013 04:28 178.150.209.83 апостал тьмы 578875
11.07.2013 07:14 109.163.244.163 Kolya 18250287гыык
11.07.2013 07:22 84.54.203.165 bestlynx 
11.07.2013 07:40 178.94.80.208 Вредность ytghtlcrfpetvjhcnm
11.07.2013 09:07 89.191.109.117 Кокетка 1234567
11.07.2013 09:08 89.191.109.117 Кокетка 1234567
11.07.2013 09:08 89.191.109.117 Кокетка fdjcmrf777
11.07.2013 09:09 89.191.109.117 Кокетка buka777
11.07.2013 09:44 91.219.251.193 bestlynx 
11.07.2013 09:44 91.219.251.193 bestlynx ьшыыщгкн25
11.07.2013 09:58 188.134.35.10 No name 
11.07.2013 10:12 188.123.230.157 Gud in tak 
11.07.2013 12:01 188.123.230.153 Шмоль ыфfulina10
11.07.2013 12:44 78.25.122.187 s] kolos1
11.07.2013 13:09 46.23.109.234 BLACK_ANGEL qaraxan
11.07.2013 13:09 46.23.109.234 BLACK_ANGEL qaraxan
11.07.2013 13:33 85.132.56.240 xarqotii xanik2983546
11.07.2013 13:34 78.84.147.53 Крестоносец otocikl155
2013-07-11 14:51 62.183.86.127 4479229 => Прототип User stuck in battle 56299.
11.07.2013 14:55 62.183.85.188  
11.07.2013 15:30 188.134.35.10 Человек Гора авоська87
2013-07-11 16:12 195.246.102.57 4479758 => I-am-WoLF-SheMale User stuck in battle 56841.
11.07.2013 16:24 86.100.76.131 Валькирия 
11.07.2013 17:40 91.218.161.65 spirocha m904233609
11.07.2013 17:40 91.218.161.65 spirocha m904233609
11.07.2013 18:10 178.94.99.62 Вредность непредсказуемость
11.07.2013 18:52 164.0.71.16 Ales erlan506739
11.07.2013 18:52 164.0.71.16 Ales 506739
11.07.2013 18:54 164.0.71.16 Ремм дигга erlan506739
11.07.2013 18:54 164.0.71.16 Ales 506739
11.07.2013 19:05 93.116.33.211 Шпилли Уилли 
11.07.2013 19:12 91.194.57.242 Сатан 2424666
11.07.2013 19:12 91.194.57.242 Сатан 2424666
11.07.2013 19:30 87.110.110.148 Крестоносец otocikl155
11.07.2013 20:30 194.213.104.5 омут я ujen1984
11.07.2013 20:42 188.134.35.10 Омут я ujen1984
11.07.2013 20:43 188.134.35.10 Омут я ujen1984
11.07.2013 20:43 89.191.109.117 Омут Я ujen84
11.07.2013 20:43 89.191.109.117 Омут Я ujen1984
11.07.2013 20:43 89.191.109.117 омут я гоут1984
11.07.2013 20:44 37.229.104.196 Апарат 
11.07.2013 20:46 194.213.104.5 омут я 25121987
11.07.2013 20:47 194.213.104.5 омут я 03101984
11.07.2013 20:47 194.213.104.5 омут я гоут25121987
11.07.2013 20:47 194.213.104.5 омут я гоут1987
11.07.2013 20:47 194.213.104.5 омут я ujen25121987
11.07.2013 20:47 194.213.104.5 омут я ujen84
11.07.2013 20:47 194.213.104.5 омут я ujen03101984
11.07.2013 21:02 46.201.175.117  
2013-07-11 21:03 195.246.102.59 4479530 => Doctor Criminal User stuck in battle 59276.
11.07.2013 21:08 193.201.98.4 актеон 
11.07.2013 21:14 178.94.99.62 Вредность ztghtlcrfpetvjcnm
11.07.2013 21:15 178.94.99.62 Вредность ztghtlcrfpetvjcnm
11.07.2013 21:15 178.94.99.62 Вредность ztghtlcrfpetvjcnm
11.07.2013 21:15 178.94.99.62 Вредность ztghtlcrfpetvjcnm
2013-07-11 21:55 91.235.37.131 4478018 => Черноглазая User stuck in battle 59631.
11.07.2013 22:00 46.201.175.117  
11.07.2013 22:28 95.111.228.108 SeDJey pfqrfjlyjzqrf
11.07.2013 22:39 188.209.245.34 Хан Батыр 310504
11.07.2013 22:39 188.209.245.34 хан батыр 310504
11.07.2013 22:41 194.213.104.5 молчание ujen1984
11.07.2013 22:42 194.213.104.5 Омут я 28119130
2013-07-11 22:53 94.19.41.150 4479260 => Фанат User stuck in battle 60064.
2013-07-12 00:34 46.211.127.35 24506 => bugaina User stuck in battle 61294.
12.07.2013 01:23 31.131.129.188 Люкен ыуты1ыуты
2013-07-12 01:32 178.72.183.190 4476958 => УкУрИнАя ЧеБуРаШкА User stuck in battle 61628.
12.07.2013 06:42 178.94.48.136 Вредность непредсказуемость
12.07.2013 06:42 178.94.48.136 Вредность непредсказуемость
12.07.2013 06:42 178.94.48.136 Вредность ztghtlcrfpetvjcnm
12.07.2013 06:43 178.94.48.136 Вредность ztghtlcrfpetvjcnm
12.07.2013 06:43 178.94.48.136 Вредность ztghtlcrfpetvjcnm
12.07.2013 06:43 178.94.48.136 Вредность ztbpdtcnzjcnm
12.07.2013 08:28 85.132.71.67 memkai@mail.ru 4714331
12.07.2013 08:38 194.213.104.5 Молчание ujen1984
12.07.2013 09:03 79.122.188.22 SilverV K.,bvfz&quot;kz
12.07.2013 09:20 46.211.122.9 bugaina vbheafr555
12.07.2013 10:13 194.213.104.5 омут я 4b694f5cf3
12.07.2013 10:14 194.213.104.5 Омут я 4b694f5cf3
12.07.2013 10:17 194.213.104.5 Омут я cd2ff14dd1
12.07.2013 10:21 194.213.104.5 Омут я 99b58455a7
12.07.2013 10:23 194.213.104.5 Омут я 99b58455a7
12.07.2013 10:24 194.213.104.5 Омут я ff460add58
12.07.2013 10:25 194.213.104.5 Омут я ff460add58
2013-07-12 10:40 178.72.183.190 4476958 => УкУрИнАя ЧеБуРаШкА User stuck in battle 63403.
12.07.2013 10:46 87.110.110.148 Крестоносец otocikl155
12.07.2013 10:52 91.124.106.208 стилет Катруся
12.07.2013 10:53 93.116.33.211 Шпилли Уилли 
12.07.2013 11:01 89.191.109.117 Омут Я ff460add58
12.07.2013 11:59 188.123.230.153 Шмоль afulina10
12.07.2013 12:00 93.212.134.59 baltozar namearnis
12.07.2013 12:09 188.123.230.153  
12.07.2013 12:46 130.0.221.72 Gannicus eqfwgq4e
12.07.2013 12:50 195.246.102.48 любимая ybubyf
12.07.2013 12:51 195.246.102.48 любимая нигина
12.07.2013 13:08 217.118.81.44 gurman sbsk31#48
12.07.2013 14:45 62.217.155.213 redevil salamsmair
12.07.2013 15:57 93.212.134.59 baltozar russkij1
12.07.2013 15:59 62.183.86.30  
12.07.2013 16:21 86.100.76.131 Валькирия 
12.07.2013 16:23 62.217.155.213 blackdevil elikrex123
12.07.2013 16:23 62.217.155.213 blackdevil elikrex
12.07.2013 16:23 62.217.155.213 blackdevil elikrex123
12.07.2013 16:24 62.217.155.213 blacdevil elikrex
12.07.2013 16:24 62.217.155.213 blacdevil elikrex123
12.07.2013 16:45 78.25.123.61 s 
2013-07-12 16:50 95.86.191.158 4479522 => ТеТ-а-ТеТ User stuck in battle 67151.
2013-07-12 16:56 95.86.191.158 4479522 => ТеТ-а-ТеТ User stuck in battle 67174.
12.07.2013 16:58 79.227.8.73 KostoloM enrico1207
12.07.2013 17:04 150.70.97.126  
2013-07-12 17:09 178.72.183.190 4476958 => УкУрИнАя ЧеБуРаШкА User stuck in battle 67209.
12.07.2013 17:21 176.113.142.232 Мадина 102030фф
12.07.2013 17:35 87.110.110.148 крестоносец otocikl155
12.07.2013 17:38 87.110.110.148 кРЕСТОНОСЕЦ MOTOCIKL155
2013-07-12 17:39 78.111.61.108 4478019 => ZEPKO User stuck in battle 67282.
12.07.2013 17:40 150.70.97.41  
12.07.2013 17:47 46.118.246.197 просто 2318950
12.07.2013 17:47 46.118.246.197 просто q2318950
12.07.2013 17:48 46.118.246.197 просто 23128632641
12.07.2013 17:48 46.118.246.197 просто q2318950
12.07.2013 17:48 46.118.246.197 просто 2318950
12.07.2013 17:53 46.118.246.197 просто 231286326412318950
12.07.2013 18:37 150.70.97.87  
12.07.2013 19:40 37.114.142.144 invader йцук123
12.07.2013 19:46 188.255.5.9 Князь 
12.07.2013 20:08 91.124.51.253 стилет rfnhecz
12.07.2013 20:16 94.19.41.150 Фанат weasdzxc
12.07.2013 20:34 91.231.255.176 дадаи рустамчон ышпфкуеф 1\\
12.07.2013 20:48 62.217.155.213 reddevil salamsmair
12.07.2013 21:32 46.247.182.232 Логин ленка36
12.07.2013 21:32 46.247.182.232  
12.07.2013 21:33 46.247.182.232  
12.07.2013 21:50 194.213.104.5 молчание ujen1984
12.07.2013 22:11 109.127.38.61 терамису 4714331
2013-07-12 22:37 86.100.76.131 4479060 => Валькирия User stuck in battle 69240.
2013-07-12 22:39 86.100.76.131 4479060 => Валькирия User stuck in battle 69280.
12.07.2013 22:55 46.247.172.87  
12.07.2013 22:57 89.191.109.117 Кокетка 
12.07.2013 23:09 62.217.155.213  
2013-07-12 23:13 94.19.41.150 4479260 => Фанат User stuck in battle 69551.
12.07.2013 23:15 84.245.204.222  
12.07.2013 23:20 91.124.134.30 СЃС‚РёР»РµС‚ Rfnhecz
12.07.2013 23:28 62.217.155.213 reddevil salamsmair
12.07.2013 23:31 94.158.57.6  
12.07.2013 23:33 94.158.57.6  
12.07.2013 23:43 46.118.118.132  
12.07.2013 23:55 94.158.57.6  
2013-07-12 23:58 178.72.183.190 4476958 => УкУрИнАя ЧеБуРаШкА User stuck in battle 69944.
12.07.2013 23:59 94.158.57.6  
13.07.2013 00:01 89.147.247.16 Musluman 
13.07.2013 00:08 89.191.109.117 кокетка 1234567
13.07.2013 00:45 46.118.118.132 нензаАа 150289q
13.07.2013 02:05 93.116.83.59 RUSSUR laskovii77maksi
13.07.2013 02:28 93.180.211.218 АК-47 zelya90
2013-07-13 04:05 195.246.102.60 4479758 => Далиша User stuck in battle 71958.
13.07.2013 05:36 88.234.208.179  
13.07.2013 06:49 94.158.57.23  
13.07.2013 07:07 94.158.57.23  
13.07.2013 07:20 94.158.57.23  
13.07.2013 08:52 188.17.25.82  
13.07.2013 10:25 109.229.192.108 CMRZ МШЕ12751
13.07.2013 10:26 109.229.192.108 CMRZ МШЕ12751
13.07.2013 10:53 109.163.244.163  
13.07.2013 11:01 77.121.214.170  
13.07.2013 11:10 84.54.203.165 bestlynx 
13.07.2013 11:39 93.116.33.211 Шпилли Уилли 1597753-
13.07.2013 12:10 94.158.57.23  
13.07.2013 12:11 178.94.176.113 Вредность непредсказуемость
13.07.2013 12:11 178.94.176.113 Вредность непредсказуемость
13.07.2013 12:11 178.94.176.113 Вредность ztghtlcrfpetvjcnm
13.07.2013 12:12 178.94.176.113 Вредность нерпедсказуемость
13.07.2013 12:12 178.94.176.113 Вредность непредсказуемость
13.07.2013 12:28 178.94.176.113 Вредность непредсказуемость
13.07.2013 12:28 178.94.176.113 Вредность непредсказуемость
13.07.2013 12:29 178.94.176.113 Вредность ztghtlcrfpetvjcnm
13.07.2013 12:29 178.94.176.113 Вредность непредсказуемость
13.07.2013 12:29 178.94.176.113 Вредность непредсказуемость
13.07.2013 12:29 178.94.176.113 Вредность ztghtlcrfpetvjcnm
13.07.2013 12:49 62.221.56.35  
13.07.2013 13:07 178.234.208.60 дея торис irjkmyfz10
13.07.2013 13:35 194.213.104.5 Молчание ujen1984
13.07.2013 13:51 37.114.142.144 Падщий ангел 010203
13.07.2013 13:51 37.114.142.144 Падший ангел 010203
13.07.2013 14:20 91.124.23.79 стилет Катруся
13.07.2013 14:20 91.124.23.79 стилет Rfnhcz
13.07.2013 14:51 62.217.155.213  
13.07.2013 14:52 62.217.155.213  
2013-07-13 14:59 193.16.101.140 24506 => bugaina User stuck in battle 75340.
13.07.2013 15:19 178.72.183.190 укуиная чебурашка aaz102
13.07.2013 15:20 178.72.183.190 укуиная чебурашка aaz102
13.07.2013 15:36 212.178.8.176  
13.07.2013 15:49 195.2.204.108 Люкен 
13.07.2013 16:09 178.94.107.239 Вредность непредсказуемость
13.07.2013 16:10 178.94.107.239 Вредность непредсказуемость
13.07.2013 16:10 178.94.107.239 Вредность ztghtlcrfpetvjcnm
13.07.2013 16:38 85.26.234.0 optimus-praym pako199213
13.07.2013 16:59 94.158.57.118  
13.07.2013 16:59 91.242.18.242 niceboy niceboy
13.07.2013 18:09 178.35.236.150  
13.07.2013 18:10 62.183.85.183  
13.07.2013 18:10 62.183.85.183 Вип ангел 654321
13.07.2013 18:29 193.104.85.213  
13.07.2013 18:29 193.104.85.213 персик 12ledigagakis
13.07.2013 18:29 193.104.85.213 персик 12дувшпфпфлші
13.07.2013 18:36 217.118.78.87 Х Дельфина Х vfvf7710
13.07.2013 18:59 178.150.209.83  
13.07.2013 19:04 178.76.46.108  
13.07.2013 19:04 178.76.46.108 Кирпич_С_неБа лфьфд7235280
13.07.2013 19:19 178.94.116.30 Вредность ztghtlcrfpetvjcnm
13.07.2013 19:20 176.8.88.135 yurec1989 123лаурель
13.07.2013 19:20 176.8.88.135 yurec1989 123лаурель
2013-07-13 19:33 88.234.208.179 4479524 => Tarman Faraon User stuck in battle 78028.
2013-07-13 19:36 91.218.171.33 4478088 => Крутой Батя User stuck in battle 78019.
2013-07-13 19:36 95.86.160.80 4479522 => ТеТ-а-ТеТ User stuck in battle 78029.
2013-07-13 19:45 95.86.160.80 4479522 => ТеТ-а-ТеТ User stuck in battle 78066.
2013-07-13 20:00 91.218.171.33 4478088 => Крутой Батя User stuck in battle 78061.
13.07.2013 20:01 91.231.255.176 дадаи рустамчон ышпфкуеф1
13.07.2013 20:11 37.26.135.34 Brain 
13.07.2013 20:12 195.246.102.55  
13.07.2013 20:51 195.182.194.185 Cерафим thevef10
13.07.2013 20:51 195.182.194.185 Cерафим thevef10
13.07.2013 21:00 86.100.76.131 Валькирия тш19лф92
13.07.2013 21:22 86.100.76.131 Валькирия тш19лф92
13.07.2013 22:06 91.219.248.160 bestlynx 
13.07.2013 22:35 46.118.118.132  
2013-07-13 23:01 195.246.102.48 4479758 => Далиша User stuck in battle 79446.
13.07.2013 23:08 212.142.69.87 last04ka 1980razvg1
13.07.2013 23:16 195.216.210.246 Логин 
13.07.2013 23:50 217.118.78.45  
13.07.2013 23:51 217.118.78.45  
13.07.2013 23:58 86.100.76.131 Валькирия de19nis68
14.07.2013 08:12 94.158.57.25  
14.07.2013 09:47 94.158.57.25  
14.07.2013 09:55 91.231.252.122 крутой батя кфьяуы4251090
14.07.2013 10:25 77.122.157.95 flopAristions qwaszx12
14.07.2013 10:25 94.158.57.25  
14.07.2013 11:12 62.183.86.211 Молганус 654321
14.07.2013 11:42 94.20.197.100 Dr Chaos sabina210303
2013-07-14 12:13 195.246.102.58 4479530 => Doctor Criminal User stuck in battle 82551.
14.07.2013 12:34 178.94.116.30 Вредность ztghtlcrfpetvjcnm
14.07.2013 12:34 178.94.116.30 Вредность ytghtlcrfpetvjhcnm
2013-07-14 12:37 176.101.4.236 4477784 => matrix User stuck in battle 82685.
2013-07-14 12:49 217.118.78.33 4479218 => Alone Liader User stuck in battle 82665.
2013-07-14 13:00 195.246.102.58 4479530 => Doctor Criminal User stuck in battle 82793.
14.07.2013 13:27 37.19.202.98 SeDJey pfqrfjklyjzqrf1989
14.07.2013 14:15 88.151.194.116 рома из баку ramil1q2w3e
14.07.2013 14:15 88.151.194.116 рома из баку ramil1q2w3e4r
14.07.2013 14:15 88.151.194.116 рома из баку 1q2w3e
14.07.2013 14:26 5.140.2.174  
14.07.2013 14:26 5.140.2.174  
14.07.2013 14:26 5.140.2.174  
14.07.2013 14:26 5.140.2.174  
14.07.2013 15:34 94.158.57.25  
14.07.2013 15:34 94.158.57.25  
14.07.2013 15:50 176.101.4.236 matrix 522988
14.07.2013 15:51 46.98.131.229 zveno 265612fed]
14.07.2013 16:06 86.100.76.131 Валькирия тш19лф92
14.07.2013 16:06 86.100.76.131 Валькирия i19ka92
14.07.2013 16:07 92.114.211.125 soulvoice 
14.07.2013 16:15 157.55.36.36  
14.07.2013 16:57 62.221.56.35  
14.07.2013 17:07 62.221.56.35  
2013-07-14 17:19 46.118.140.60 4479341 => kyzia User stuck in battle 84785.
14.07.2013 17:33 86.100.76.131 Валькирия i19ka92
14.07.2013 18:04 91.231.252.122 крутой батя ramzes
14.07.2013 18:04 91.231.252.122 крутой батя /ramzes4251090
14.07.2013 18:04 91.231.252.122  
14.07.2013 18:11 89.147.247.16 Musluman 055063806
2013-07-14 18:15 93.79.74.130 4479055 => valyrik User stuck in battle 85271.
2013-07-14 18:16 109.227.98.117 4476137 => ксенька User stuck in battle 85274.
2013-07-14 18:18 109.227.98.117 4476137 => ксенька User stuck in battle 85282.
2013-07-14 18:34 93.79.74.130 4479055 => valyrik User stuck in battle 85469.
14.07.2013 18:42 91.231.255.176  
14.07.2013 19:18 62.217.155.213 reddevil salamsmair
14.07.2013 20:06 188.227.210.1 Привет из Баку CEYHUN635
14.07.2013 20:16 185.13.196.189 xIMPERATORx elem666
14.07.2013 20:24 188.32.216.165 Шмоль 
14.07.2013 20:46 62.183.86.159  
14.07.2013 21:21 178.94.110.19 Вредность непредсказуемость
14.07.2013 21:21 178.94.110.19 Вредность ztghtlcrfpetvjcnm
14.07.2013 21:33 217.118.78.82 Логин 
2013-07-14 21:47 195.246.102.55 4479758 => Далиша User stuck in battle 86631.
2013-07-14 21:48 195.246.102.55 4479758 => Далиша User stuck in battle 86697.
2013-07-14 21:48 195.246.102.55 4479758 => Далиша User stuck in battle 86704.
2013-07-14 21:49 195.246.102.55 4479758 => Далиша User stuck in battle 86713.
2013-07-14 21:49 91.231.252.122 4478088 => Крутой Батя User stuck in battle 86713.
2013-07-14 21:49 188.17.47.135 4478193 => Святой Тамплиер User stuck in battle 86714.
14.07.2013 21:57 95.111.216.40 SeDJey pfqrfjlyjzqrf
2013-07-14 22:11 176.101.4.236 4477784 => matrix User stuck in battle 86874.
2013-07-14 22:19 176.101.4.236 4477784 => matrix User stuck in battle 86937.
2013-07-14 22:19 37.61.72.11 4478408 => каталонец User stuck in battle 86947.
2013-07-14 22:19 195.246.102.56 4479758 => Далиша User stuck in battle 86947.
2013-07-14 22:21 195.246.102.56 4479758 => Далиша User stuck in battle 86971.
2013-07-14 22:23 195.246.102.56 4479758 => Далиша User stuck in battle 86994.
2013-07-14 22:24 37.61.72.11 4478408 => каталонец User stuck in battle 86996.
2013-07-14 22:25 195.246.102.56 4479758 => Далиша User stuck in battle 87007.
2013-07-14 22:25 37.61.72.11 4478408 => каталонец User stuck in battle 87010.
2013-07-14 22:26 37.61.72.11 4478408 => каталонец User stuck in battle 87015.
14.07.2013 22:35 77.122.157.95 flopAristions qwaszx12
14.07.2013 22:35 178.234.85.238 Дея Торис 336169
14.07.2013 22:36 84.50.232.237 Capita tammiku
2013-07-14 23:14 93.116.33.211 4477659 => Шпилли Уилли User stuck in battle 87409.
2013-07-14 23:16 46.211.125.178 24506 => bugaina User stuck in battle 87439.
14.07.2013 23:34 95.153.88.28 человек 289940200
2013-07-14 23:36 46.211.125.178 24506 => bugaina User stuck in battle 87634.
15.07.2013 01:21 95.86.181.147 Тет-а-тет 463267
15.07.2013 02:36 46.118.118.132  
15.07.2013 03:38 176.116.67.255 Teens 91415587
15.07.2013 06:56 188.134.33.232 IamExperience 
15.07.2013 08:17 84.54.203.165 bestlynx ьшыыщгкн25
15.07.2013 08:30 178.35.230.91 Volan De Mort кантик
15.07.2013 08:33 94.228.21.231 Одинокий Волк ассасин1234
15.07.2013 10:04 212.100.134.98 Графин qwazaz517
15.07.2013 10:20 91.231.255.176  
15.07.2013 12:09 176.8.88.135 yurec1989 123kfehtkm\\
15.07.2013 12:12 188.32.216.165  
15.07.2013 12:20 79.122.188.22  
15.07.2013 12:45 89.147.247.16  
15.07.2013 12:45 89.147.247.16  
15.07.2013 12:55 94.158.57.212  
15.07.2013 13:34 95.111.236.253 SeDJey pfqrfjlyjzqrf1989]
15.07.2013 14:28 46.23.108.65 b 
15.07.2013 14:40 109.191.17.206 pointtouch 
15.07.2013 14:47 95.132.237.254 Freedom 
15.07.2013 15:31 86.100.76.131 Валькирия 
2013-07-15 16:48 195.246.102.60 4479530 => Doctor Criminal User stuck in battle 91939.
15.07.2013 17:06 46.118.118.132  
15.07.2013 17:07 46.118.118.132 мандус 1qa2ws3ed4rf
15.07.2013 17:40 176.8.236.176 DR house 2811130
15.07.2013 17:40 176.8.236.176 DR house 2811130
15.07.2013 17:50 91.218.171.89 Дед мороз ышпфкуеф 1
15.07.2013 17:50 91.218.171.89 Дед мороз ышпфкуеф 1
15.07.2013 17:50 91.218.171.89 Дед мороз sigareta 1
2013-07-15 17:53 95.86.181.186 4479522 => ТеТ-а-ТеТ User stuck in battle 92481.
2013-07-15 18:10 178.72.183.190 4476958 => УкУрИнАя ЧеБуРаШкА User stuck in battle 92601.
15.07.2013 18:13 193.201.98.4 актеон 07011963gfgf
15.07.2013 18:25 176.120.48.140  
15.07.2013 18:45 62.217.155.213  
2013-07-15 18:56 95.86.181.186 4479522 => ТеТ-а-ТеТ User stuck in battle 92818.
2013-07-15 19:21 93.116.33.211 4477659 => Шпилли Уилли User stuck in battle 92967.
15.07.2013 20:42 178.35.230.191  
15.07.2013 21:32 178.34.219.255  
15.07.2013 21:43 188.134.33.234 Духовность 999999
15.07.2013 21:45 188.134.33.234 Духовность 999999
15.07.2013 22:36 193.150.80.8 bestlynx 
15.07.2013 22:43 178.234.85.161 дея торис IRJKMYFZ12
15.07.2013 22:43 178.234.85.161 дея торис IRJKMYFZ10
15.07.2013 22:43 178.234.85.161 дея торис irjkmyfz10
15.07.2013 22:56 193.150.80.8 bestlynx ьшыыщгкн25
15.07.2013 23:10 100.43.83.142  
15.07.2013 23:40 178.150.209.83 апостал тьмы 578875
16.07.2013 00:36 95.132.59.11 мастер клинка 
16.07.2013 00:36 46.247.178.111 удар пароль
16.07.2013 00:37 95.132.59.11 мастер клинка падкова666
2013-07-16 00:49 46.211.182.152 24506 => bugaina User stuck in battle 95098.
16.07.2013 02:06 78.37.35.176 karel 09vtufnhjy
16.07.2013 02:06 78.37.35.176 karel 09мегатрон
16.07.2013 09:41 195.246.102.50  
16.07.2013 09:51 195.246.102.55 dotor criminal ben1010
16.07.2013 10:16 178.76.34.125 кирпич_С_неБа лыьыд7235280
16.07.2013 10:22 212.56.195.86 CLON DENIS81
2013-07-16 11:40 46.200.99.163 4476861 => ICE phoenix User stuck in battle 97502.
16.07.2013 12:01 178.94.134.11 Вредность ztghtlcrfpetvjcnm
16.07.2013 12:30 85.26.234.95 Optimus-Praym pako199213
16.07.2013 12:30 85.26.234.95 optimus-praym pako199213
16.07.2013 13:37 195.246.102.51 doctor crminal ben1010
16.07.2013 13:37 195.246.102.51 doctor crminal ben1010
16.07.2013 13:57 178.72.181.232 Light-Bringer A244744
16.07.2013 14:48 134.255.228.221 hass runner11
16.07.2013 14:57 94.180.104.17 Кровавый вано 
16.07.2013 14:58 94.180.104.17 Кровавый Вано шашка11
16.07.2013 15:15 212.100.134.98 Графин wazaz12
16.07.2013 15:38 78.25.122.133 s\' 
16.07.2013 15:38 78.25.122.133 s\' 
16.07.2013 15:38 78.25.122.133 s\'\' 
2013-07-16 16:08 195.246.102.56 4479758 => Далиша User stuck in battle 99486.
2013-07-16 16:25 195.246.102.56 4479758 => Далиша User stuck in battle 99590.
16.07.2013 16:33 188.32.216.165  
2013-07-16 16:37 95.86.181.13 4479522 => ТеТ-а-ТеТ User stuck in battle 99576.
2013-07-16 16:43 85.9.137.126 4477018 => BOSS User stuck in battle 99757.
16.07.2013 16:44 188.32.216.165 Шмоль safuina10
2013-07-16 16:48 85.9.137.126 4477018 => BOSS User stuck in battle 99780.
16.07.2013 17:03 78.111.187.217 ВНИМАНИЕ Я БЕРЁЗКА24
16.07.2013 17:04 78.111.187.217 ВНИМАНИЕ Я БЕРЁЗКА24
2013-07-16 17:32 195.246.102.56 4479758 => Далиша User stuck in battle 100012.
16.07.2013 17:37 37.61.58.20 вор всегда зор idos055
16.07.2013 17:56 84.54.203.165 bestlynx ьшыыщгкн25
16.07.2013 18:24 195.2.204.108 Люкен 
2013-07-16 20:53 195.246.102.57 4479530 => Doctor Criminal User stuck in battle 101329.
16.07.2013 20:55 86.100.76.131 Валькирия ni`9ka92
16.07.2013 21:03 86.100.76.131 Валькирия 
16.07.2013 21:04 86.100.76.131 Валькирия тш19лф92
2013-07-16 22:34 85.9.137.124 4477018 => BOSS User stuck in battle 102145.
16.07.2013 22:56 178.94.8.49 Вредность ztghtlcrfpetvjcnm
16.07.2013 23:17 86.100.76.131 Р’Р°Р»СЊРєРёСЂРёСЏ ni19ka92
16.07.2013 23:20 85.9.137.122 BOSS masxad88
16.07.2013 23:34 94.179.41.218 Укуриный ghbvf119
2013-07-16 23:48 85.9.137.122 4477018 => BOSS User stuck in battle 102703.
16.07.2013 23:53 89.116.23.221 maly 
16.07.2013 23:53 89.116.23.221 maly kamikadza
16.07.2013 23:53 89.116.23.221 maly laosas999
16.07.2013 23:54 89.116.23.221 maly kamikadza999
2013-07-17 00:12 95.86.181.13 4479522 => ТеТ-а-ТеТ User stuck in battle 102809.
17.07.2013 00:19 94.20.221.73 шутник 870457
17.07.2013 00:19 94.20.221.73 шутник 8870457
2013-07-17 02:34 95.86.181.13 4479522 => Ахиллес User stuck in battle 103551.
17.07.2013 02:43 85.9.137.124 BOSS Ьфычфв88
17.07.2013 03:02 176.116.67.255 Teens richchchi6636
17.07.2013 09:15 109.229.192.108 CMRZ МШЕ12751
17.07.2013 09:16 217.118.95.84 volter evven88
17.07.2013 09:16 109.229.192.108 CMRZ МШЕ12751
17.07.2013 09:16 109.229.192.108 CMRZ МШЕ12751
17.07.2013 10:35 95.179.51.238 Бич Божий 2251583
17.07.2013 10:46 178.94.8.49 Вредность ztbpdtcnzjcnm
17.07.2013 10:46 178.94.8.49 Вредность ytbpdtcnyjcnm
17.07.2013 10:46 178.94.8.49 Вредность неизвестность
17.07.2013 10:47 178.94.8.49 Вредность непредсказуемость
17.07.2013 10:47 178.94.8.49 Вредность непредсказуемость
17.07.2013 10:47 178.94.8.49 Вредность ztghtlcrfpetvjcnm
17.07.2013 10:55 91.218.170.101 земляно 
17.07.2013 11:09 5.250.222.6 invader йцук123
17.07.2013 12:06 94.20.29.16 Боевулф salam555
17.07.2013 12:30 188.32.216.165  
17.07.2013 13:57 95.26.183.82 Falcon moestro13z5513
17.07.2013 13:58 95.26.183.82 Falcon PRIMYLA58K58K13V1324
17.07.2013 14:22 87.219.162.124 WindowsXP hpl1908w
17.07.2013 14:24 91.124.120.31 стилет Катруся
2013-07-17 15:14 94.20.245.80 4479916 => Komandos User stuck in battle 106927.
2013-07-17 15:25 195.246.102.60 4479758 => Далиша User stuck in battle 106972.
2013-07-17 15:48 37.61.54.83 4479897 => Вор Всегда Зор User stuck in battle 107280.
2013-07-17 15:59 94.20.245.80 4479916 => Komandos User stuck in battle 107385.
2013-07-17 16:23 37.61.54.83 4479897 => Вор Всегда Зор User stuck in battle 107589.
2013-07-17 16:58 91.200.64.198 4479926 => Plan4eg User stuck in battle 107918.
2013-07-17 17:39 93.116.33.211 4477659 => Шпилли Уилли User stuck in battle 108212.
2013-07-17 17:43 46.118.118.132 4478569 => азмандус User stuck in battle 108268.
2013-07-17 17:55 195.246.102.48 4479530 => Doctor Criminal User stuck in battle 108438.
17.07.2013 17:59 188.32.216.165  
17.07.2013 18:17 195.246.102.59 doctor criminal den1010
17.07.2013 18:30 178.92.67.238 Freedom 
17.07.2013 18:46 178.150.209.83 грюндик 27773462
17.07.2013 18:46 178.150.209.83 грюндик 2734622
17.07.2013 18:46 178.150.209.83 грюндик 7604213
17.07.2013 18:46 178.150.209.83 грюндик 76042133
17.07.2013 19:00 178.94.188.85 инкогниито ztghtlcrfpetvjcnm
17.07.2013 19:00 178.94.188.85 инкогниито ytghtlcrfpetvjcnm
17.07.2013 19:00 178.94.188.85 инкогниито непредсказуемость
17.07.2013 19:01 178.94.188.85 инкогниито непредсказуемость
17.07.2013 19:01 178.94.188.85 инкогниито ztghtlcrfpetvjcnm
17.07.2013 19:01 178.94.188.85 инкогниито ytghtlcrfpetvjcnm
17.07.2013 19:04 193.161.14.173 Добрый фф222яя
2013-07-17 19:27 164.215.103.209 4479925 => MIman User stuck in battle 108906.
2013-07-17 19:41 93.116.33.211 4477659 => Шпилли Уилли User stuck in battle 108873.
2013-07-17 20:02 195.246.102.59 4479758 => Далиша User stuck in battle 108768.
2013-07-17 21:10 188.134.35.10 7 => No Name User stuck in battle 109718.
2013-07-17 21:25 178.150.209.83 4476298 => Грюндик User stuck in battle 109747.
2013-07-17 21:29 95.86.168.118 4479522 => Ахиллес User stuck in battle 109823.
2013-07-17 21:48 195.246.102.59 4479758 => Далиша User stuck in battle 109858.
17.07.2013 21:50 78.111.187.77 ВНИМАНИЕ Я ,th`prf24
17.07.2013 21:54 176.113.140.193 крутой батя кфьяуы4251090
2013-07-17 22:00 91.124.190.17 4477531 => Стилет User stuck in battle 110038.
17.07.2013 22:15 193.16.101.239 Ревизор йфяяфй
17.07.2013 22:59 46.162.214.87 ARTURx hero63
17.07.2013 22:59 93.79.74.130 valyrik 322117
17.07.2013 23:19 188.255.80.25  
17.07.2013 23:31 89.147.247.16  
2013-07-18 00:23 46.23.109.33 4479685 => BLACK_ANGEL User stuck in battle 111569.
2013-07-18 00:23 195.246.102.55 4479530 => Doctor Criminal User stuck in battle 111569.
2013-07-18 02:00 195.246.102.55 4479758 => Далиша User stuck in battle 112035.
2013-07-18 02:13 95.86.168.118 4479522 => Ахиллес User stuck in battle 112047.
2013-07-18 07:52 95.86.168.118 4479522 => Ахиллес User stuck in battle 112474.
2013-07-18 09:25 95.86.168.118 4479522 => Ахиллес User stuck in battle 112840.
18.07.2013 09:36 188.253.168.38 вор всегда зор 055640100
18.07.2013 10:04 89.191.109.117 Кокетка nikola777
18.07.2013 10:33 77.122.157.95 flopAristions qwaszx12
18.07.2013 11:45 95.111.221.137 Кокетка nikola777
18.07.2013 11:52 77.121.214.170 FenShui zaq1223
18.07.2013 12:05 2.134.193.94 ололош nbvrhfcfdxbr
18.07.2013 12:25 109.229.192.108 CMRZ ВЩПШ230239
18.07.2013 13:14 89.147.247.16  
18.07.2013 13:15 178.237.79.187 zepko emrah191
18.07.2013 13:34 212.142.69.87 last04ka 1980razevg
18.07.2013 13:48 188.32.216.165 шмоль ыфагдштф10
2013-07-18 13:49 85.9.137.124 4477018 => BOSS User stuck in battle 114482.
18.07.2013 13:58 83.149.8.194  
18.07.2013 14:02 77.121.214.170 FenShuii zaq123
2013-07-18 14:15 195.246.102.55 4479758 => Далиша User stuck in battle 114871.
18.07.2013 15:34 212.56.195.86 CLON DENIS81
2013-07-18 15:44 195.246.102.55 4479758 => Далиша User stuck in battle 115564.
18.07.2013 16:03 91.218.169.103 Мадинка 102030фф
18.07.2013 16:03 91.218.169.103 Мадинка 102030aa
18.07.2013 16:03 91.218.169.103 мадина 102030фф
18.07.2013 16:14 93.116.33.211 Шпийлли-Уилли 159753
18.07.2013 16:55 89.221.21.211 Святой тамплиер eqfwgq4
18.07.2013 17:48 92.115.214.49 Jpnh Carter sadaclia12
18.07.2013 17:55 31.43.26.171 Ribellion artem777
18.07.2013 17:55 31.43.26.171 Ribellion 5493708
18.07.2013 17:59 86.100.76.131 Валькирия тш19лф92
18.07.2013 18:20 94.180.104.17 Кровавый Вано шашка11
18.07.2013 18:37 212.142.69.87 last04ka 1980razeevg1
18.07.2013 19:02 37.99.107.90 Noserdamus leva1963
18.07.2013 19:37 195.246.102.50  
18.07.2013 19:44 89.147.201.136 fako salamikos
18.07.2013 19:44 89.147.201.136 Fako salamikos
18.07.2013 19:50 195.246.102.50  
2013-07-18 19:51 95.86.161.176 4479522 => Ахиллес User stuck in battle 117138.
2013-07-18 19:54 178.72.183.190 4476958 => УкУрИнАя ЧеБуРаШкА User stuck in battle 117198.
18.07.2013 20:00 37.61.43.8 isman ram6201770
18.07.2013 20:11 46.182.90.132 Milkyway killer11
18.07.2013 20:12 109.87.87.137 Komishlod4r7bq0mjt3 
18.07.2013 20:58 93.116.83.59 RUSSUR laskovii77
2013-07-18 21:05 91.235.37.239 4478018 => Черноглазая User stuck in battle 117909.
18.07.2013 21:31 212.3.100.187 Emhyr var Emreis 10я20ч30с
18.07.2013 21:31 212.3.100.187 Emhyr var Emreis афтефын101299
18.07.2013 21:31 212.3.100.187 Emhyr var Emreis 101299
2013-07-18 21:31 193.161.14.169 24248 => Добрый User stuck in battle 118116.
18.07.2013 21:31 212.3.100.187 Emhyr var Emreis афтефын555
18.07.2013 21:32 212.3.100.187 Emhyr var Emreis fantasy555
2013-07-18 21:39 93.116.33.211 4477659 => Шпилли Уилли User stuck in battle 118161.
18.07.2013 21:45 213.154.25.57 mexanik vaz210-7
2013-07-18 22:02 91.231.255.176 4479868 => Дед мороз User stuck in battle 118386.
18.07.2013 22:16 188.253.198.207 korok_is_baku orik9562136
18.07.2013 22:30 195.246.102.50 виннид пух ben1010
2013-07-18 22:37 77.122.157.95 4478225 => Непобедимый User stuck in battle 118813.
18.07.2013 22:40 212.3.100.187  
18.07.2013 23:02 46.22.229.246 lordof ceyhun22
19.07.2013 00:03 128.73.177.7 deos 
19.07.2013 00:04 93.212.129.149 Кокетка nikola777
19.07.2013 00:04 93.212.129.149 Кокетка nikola777
19.07.2013 00:09 193.150.83.240 bestlynx ьшыыщгкн25
19.07.2013 00:17 93.212.129.149 Кокетка nikola666
19.07.2013 00:39 193.150.83.240 bestlynx ьшыыщгкн25
19.07.2013 00:40 193.150.83.240 bestlynx 
19.07.2013 08:29 178.72.181.232 hartuik Arutik258
2013-07-19 09:29 195.246.102.52 4479530 => Винни ПуХ User stuck in battle 120995.
19.07.2013 11:50 188.255.80.25 шалом safulina10
19.07.2013 11:51 188.255.80.25 шмоль safulinf10
19.07.2013 11:54 46.182.90.70 OnlyBack killer1
19.07.2013 11:54 46.182.90.70 OnlyBack killer1
19.07.2013 12:09 178.213.133.131  
19.07.2013 12:09 178.213.133.131  
19.07.2013 12:13 95.221.103.237 раз-два 
19.07.2013 12:19 188.255.80.25  
19.07.2013 12:19 178.67.24.38 splashvbg 159753456\\\\
19.07.2013 12:46 188.72.183.145 gunesli ibrahimov
19.07.2013 13:02 89.147.247.16 Musluman 557063806
2013-07-19 13:31 178.72.183.190 4476958 => УкУрИнАя ЧеБуРаШкА User stuck in battle 122425.
19.07.2013 13:47 46.22.227.233 stariy quli94027610
19.07.2013 13:51 89.191.109.117 Кокетка fdjcmrf777
19.07.2013 13:52 89.191.109.117 Кокетка nikola26
19.07.2013 14:15 86.100.76.131 Валькирия тш19лф92
19.07.2013 14:25 62.212.235.118 arabello dota175
19.07.2013 14:45 46.22.234.17 Невидим 123456
19.07.2013 15:13 80.90.24.214 Plan4eg vialik93
19.07.2013 16:49 92.124.44.208 Punisher ghbgkskb777
19.07.2013 16:49 92.124.44.208 Punisher ghbgkskb666
19.07.2013 16:50 92.124.44.208 Punisher ghbgkskb77
19.07.2013 16:50 92.124.44.208 Punisher ghbgkskb555
19.07.2013 16:50 92.124.44.208 Punisher cbvdjk555
19.07.2013 16:51 92.124.44.208 Punisher ghbrjk666
19.07.2013 16:54 92.124.44.208 Punisher 4e7001ec46
19.07.2013 16:54 100.43.83.142  
19.07.2013 16:55 92.124.44.208 Punisher 4e7001ec46
19.07.2013 16:57 188.255.80.25  
19.07.2013 17:55 93.116.83.59 RUSSUR laskovii77
19.07.2013 18:37 89.191.109.117 Кокетка nikola26
19.07.2013 19:08 95.158.48.43 агент малдер журавель5301558
2013-07-19 19:43 95.86.178.230 4479522 => Ахиллес User stuck in battle 125367.
2013-07-19 20:51 95.86.178.230 4479522 => Ахиллес User stuck in battle 125677.
19.07.2013 21:07 86.100.76.131 Валькирия ni91ka92
2013-07-19 22:05 37.57.220.119 4479556 => BILBA-SUMKIN User stuck in battle 126247.
2013-07-19 22:16 5.134.59.92 4478019 => ZEPKO User stuck in battle 126388.
2013-07-19 22:20 95.86.178.230 4479522 => Ахиллес User stuck in battle 126391.
19.07.2013 23:41 178.76.15.29 komandos 
20.07.2013 00:31 188.32.216.165 Шмоль ыфагдштф10
20.07.2013 01:37 93.170.12.232 jjif wasp3773759
2013-07-20 01:57 88.151.196.47 4479673 => REDDEVIL User stuck in battle 128731.
2013-07-20 02:08 95.86.178.230 4479522 => Ахиллес User stuck in battle 128813.
20.07.2013 02:23 46.247.190.89  
20.07.2013 02:28 46.175.208.233 убийца йцу21342
2013-07-20 03:16 88.151.196.47 4479673 => REDDEVIL User stuck in battle 129165.
20.07.2013 04:48 46.247.190.89  
20.07.2013 04:54 46.247.190.89  
2013-07-20 08:10 195.246.102.50 4479530 => Винни ПуХ User stuck in battle 130164.
20.07.2013 08:59 94.179.17.179 Укуриный 
20.07.2013 09:06 178.94.112.96 Вредность ytbpdtcnyjcnm
20.07.2013 09:06 178.94.112.96 Вредность неизвестность
20.07.2013 09:06 178.94.112.96 Вредность ztghtlcrfpetvjcnm
20.07.2013 09:06 178.94.112.96 Вредность непредсказуемость
2013-07-20 09:31 195.246.102.56 4479560 => Земляной User stuck in battle 130723.
2013-07-20 10:52 195.246.102.60 4479530 => Винни ПуХ User stuck in battle 131142.
2013-07-20 10:58 195.246.102.60 4479530 => Винни ПуХ User stuck in battle 131168.
20.07.2013 11:06 84.54.203.165 bestlynx ьшыыщгкн25
20.07.2013 11:45 46.182.90.72 Onlyback killr11
20.07.2013 11:50 178.76.50.196 невидим atanpetyseer6745965
20.07.2013 11:51 178.76.50.196 невидим atanpeysery7re
20.07.2013 11:52 178.76.50.196 невидим atanpeyser74595645
20.07.2013 13:58 5.134.59.37 emrah1991 
20.07.2013 14:01 94.139.138.121 soulvoice 
20.07.2013 14:07 213.87.133.178 Шмоль afulina10
20.07.2013 14:53 89.147.247.16 Musluman 055706306
20.07.2013 14:53 89.147.247.16 Musluman 055706306
20.07.2013 15:33 62.217.155.213 Логин 
20.07.2013 15:33 62.217.155.213  
2013-07-20 15:45 195.246.102.56 4479530 => Винни ПуХ User stuck in battle 134082.
20.07.2013 16:57 178.94.90.93 Вредность непредсказуемость
20.07.2013 18:02 188.134.32.9 Amidas 
20.07.2013 18:02 188.134.32.9 Amidas 111222
2013-07-20 18:06 5.134.59.37 4478019 => ZEPKO User stuck in battle 135703.
20.07.2013 18:10 91.191.205.247 саламлар eqan456
20.07.2013 18:13 46.247.189.125  
20.07.2013 18:27 91.231.255.176 a princces z m904233609
20.07.2013 18:31 193.107.101.163 bestlynx MISSOURY25
20.07.2013 18:34 109.237.124.91 LORDOF CEKA22
2013-07-20 19:13 217.19.208.105 4479653 => BPAN User stuck in battle 136487.
20.07.2013 19:19 92.49.231.239 Меломан дубровка111
20.07.2013 19:28 46.247.189.125  
2013-07-20 19:29 93.79.74.130 4479055 => valyrik User stuck in battle 136728.
2013-07-20 19:38 109.227.102.31 4476137 => ксенька User stuck in battle 136824.
2013-07-20 19:42 91.231.252.64 4478088 => Крутой Батя User stuck in battle 136872.
2013-07-20 19:54 37.57.220.119 4479556 => BILBA-SUMKIN User stuck in battle 136977.
20.07.2013 20:54 83.151.9.249 Prime trewq123
20.07.2013 20:54 83.151.9.249 Prime qwerty123
20.07.2013 20:54 83.151.9.249 Prime trewq321
20.07.2013 20:55 83.151.9.249 Prime ytrewq123
20.07.2013 20:55 83.151.9.249 ssergeev76@mail.ru trewq321
20.07.2013 20:56 83.151.9.249 Prime trewq321
20.07.2013 20:56 83.151.9.249 Pride trewq321
20.07.2013 20:57 83.151.9.249 Pride trewq321
20.07.2013 20:57 83.151.9.249 Prime trewq321
20.07.2013 21:13 188.64.13.164 miman mirizad53626
20.07.2013 21:18 91.190.115.250  
20.07.2013 22:04 91.231.252.64 крутой батя ramzes4521090
20.07.2013 22:06 91.242.19.152 white old wolf natiq54
2013-07-20 22:06 5.134.59.37 4478019 => ZEPKO User stuck in battle 137922.
20.07.2013 22:58 178.94.99.182 вредность ztghtlcrfpetvjcnm
20.07.2013 22:58 178.94.99.182 вредность непредсказуемость
20.07.2013 23:48 89.147.247.16 Musluman 557063806
21.07.2013 00:31 94.20.191.219 lordof ceka23
21.07.2013 02:17 217.168.186.95  
2013-07-21 02:30 79.140.13.134 4478215 => Хука User stuck in battle 139622.
21.07.2013 03:15 188.237.113.114 InvadeR 010203
21.07.2013 03:15 188.237.113.114 InvadeR 010203
21.07.2013 10:43 89.191.109.117 Кокетка nikola26
21.07.2013 12:00 62.183.85.168 Volan de Mort kantik
21.07.2013 12:01 62.183.85.168 Volan de Mort кантик
21.07.2013 12:01 62.183.85.168 Volan de Mort xtxtyjd rfyntvbh
21.07.2013 12:06 94.19.41.150 Фанат qweasdzxc
21.07.2013 12:54 193.16.101.140 bugaina vbheafr5
21.07.2013 13:11 5.44.39.30 memkai@mail.ru 4714331
21.07.2013 13:11 5.44.39.30 memkai@mail.ru 4714331
21.07.2013 13:11 5.44.39.30 memkai@mail.ru 4714331
21.07.2013 13:14 193.16.101.140  
21.07.2013 13:18 176.8.238.102 Апарат 
21.07.2013 13:32 77.121.214.170 ВНИМАНИЕ Я берёзкаа24
21.07.2013 13:40 193.16.101.140  
21.07.2013 13:43 91.190.115.250 smert kolos1
2013-07-21 14:11 193.16.101.140 24506 => bugaina User stuck in battle 141841.
21.07.2013 14:11 94.179.146.63 f 
21.07.2013 14:47 188.32.216.165  
21.07.2013 15:00 46.247.162.243 злюка 
21.07.2013 15:01 77.121.214.170 ВНИМАНИЕ Я берёзка224
2013-07-21 16:52 91.235.38.43 4478018 => Черноглазая User stuck in battle 142942.
2013-07-21 17:01 213.87.241.22 4479422 => седой User stuck in battle 143004.
21.07.2013 17:31 176.101.4.236 arek 52208
21.07.2013 17:39 91.190.115.250 dexer kolos1
2013-07-21 17:43 91.190.115.250 4476068 => Dexter User stuck in battle 143321.
21.07.2013 18:27 188.253.186.157 КАТАЛОНЕЦ 
2013-07-21 18:47 95.86.163.210 4479522 => Ахиллес User stuck in battle 143670.
21.07.2013 18:47 188.134.34.34 король порно 0123456789
21.07.2013 18:48 188.134.34.34 casper26 0123456789
21.07.2013 18:48 188.134.34.34 casper 0123456789
21.07.2013 18:50 188.134.34.34 Casper26 0123456789
21.07.2013 18:50 188.134.34.34 король порно 0123456789
21.07.2013 18:55 94.25.229.108 nikolaisan qawsedrftgy19764
21.07.2013 18:58 94.25.229.108 колянычам f3ada87527
21.07.2013 18:59 94.25.229.108 колянычам f3ada87527
21.07.2013 19:01 94.25.229.108 коляныч qawsedrftgy19764
21.07.2013 19:01 94.25.229.108 коляныч йфцыувка19764
2013-07-21 19:34 77.122.157.95 4478225 => Непобедимый User stuck in battle 143831.
21.07.2013 20:27 94.248.23.162 Конор хомичолег111
21.07.2013 20:28 94.248.23.162 Конор рщьшсрщдуп111
21.07.2013 20:28 94.248.23.162 Конор рщьшср111
21.07.2013 20:29 94.248.23.162 Конор хомич111
21.07.2013 20:29 94.248.23.162 Конор щрщьшср111
21.07.2013 20:31 94.248.23.162 Конор [jvbxjktu111
21.07.2013 20:31 94.248.23.162 Конор ohomich111
21.07.2013 20:32 94.248.23.162 Конор homich111
21.07.2013 20:32 94.248.23.162 Конор homicholeg111
21.07.2013 20:32 94.248.23.162 Конор [jvbx111
21.07.2013 20:43 94.248.23.162 Конор хомичо111
21.07.2013 21:15 188.64.10.172 miman mmirizade53626
21.07.2013 21:28 95.182.81.200 bestlynx ьшыыщгкен25
21.07.2013 21:34 176.8.22.39 Ласковый Мишка 
2013-07-21 22:30 195.246.102.59 4479758 => Далиша User stuck in battle 144502.
2013-07-21 22:33 95.86.163.210 4479522 => Ахиллес User stuck in battle 144847.
2013-07-21 22:39 130.0.11.64 4479470 => bez pridel User stuck in battle 145222.
2013-07-21 22:42 95.86.163.210 4479522 => Ахиллес User stuck in battle 145245.
21.07.2013 22:45 86.100.76.131 Валькирия тш19лф92
2013-07-21 22:58 130.0.11.64 4479470 => bez pridel User stuck in battle 145327.
21.07.2013 23:05 85.9.137.125 BOSS Nasxad88
2013-07-21 23:13 130.0.11.64 4479470 => bez pridel User stuck in battle 145442.
21.07.2013 23:40 95.86.163.210 Ахиллес 4632967
2013-07-21 23:52 130.0.11.64 4479442 => stariy User stuck in battle 145739.
22.07.2013 00:07 79.124.179.143 Nlkolaevich 
2013-07-22 00:15 78.111.187.195 4479886 => Van-Helsing User stuck in battle 145872.
22.07.2013 00:30 94.20.243.144 вор всегда зор dos055
22.07.2013 01:05 195.246.102.48 далиша нигина
22.07.2013 01:06 195.246.102.48 далиша нигина
22.07.2013 01:12 195.246.102.48 далиша нигина
22.07.2013 01:14 195.246.102.48 далиша dbea47235d
22.07.2013 01:14 195.246.102.48 далиша dbea47235d
22.07.2013 01:14 195.246.102.48 далиша nigina100107
22.07.2013 01:18 46.247.186.193  
2013-07-22 01:22 93.116.33.211 4477659 => Шпилли Уилли User stuck in battle 146123.
2013-07-22 01:30 195.182.194.213 4478374 => Серафим User stuck in battle 146211.
2013-07-22 02:00 94.19.41.150 4479988 => Ультрас User stuck in battle 146293.
22.07.2013 02:05 77.244.115.12 patron elik2010
2013-07-22 02:44 78.111.187.195 4479886 => Van-Helsing User stuck in battle 146424.
22.07.2013 08:41 5.250.222.6 invader 010203
22.07.2013 08:45 178.72.181.232 Harutik Фкгешл258
22.07.2013 11:04 178.216.16.138 ребенок 331274
22.07.2013 11:48 188.32.222.82  
22.07.2013 13:11 86.100.76.131 Р’Р°Р»СЊРєРёСЂРёСЏ ni19ka92
2013-07-22 13:47 89.147.247.16 4479636 => Musluman User stuck in battle 148462.
22.07.2013 14:03 178.122.10.20 Captain ыфшьфт15
2013-07-22 14:31 217.19.208.107 4479653 => BPAN User stuck in battle 148633.
22.07.2013 14:32 178.122.10.20 Captain 
22.07.2013 14:44 130.185.38.237 Van-Helsing pfqrfjlyjzqrf
22.07.2013 15:10 94.158.57.174 Дьяволёнок БескаРулит
22.07.2013 15:22 77.50.223.13 liberal herio63
22.07.2013 16:48 79.124.216.210 Nlkolaevich zelya90
22.07.2013 16:48 79.124.216.210 Nlkolaevich zelya90
22.07.2013 16:49 79.124.216.210 Nlkolaevich zelya90
22.07.2013 16:50 79.124.216.210 Nlkolaevich andtey90
22.07.2013 16:53 95.132.156.129 отец онуфрий korn3loko43
22.07.2013 16:54 95.132.156.129 отецонуфрий korn3loko43
22.07.2013 17:12 195.246.102.60 далиша нигина100107
22.07.2013 17:14 94.28.252.162 Waterfall fox123fox123
22.07.2013 17:14 94.28.252.162 Waterfall 123fox123
22.07.2013 17:14 94.28.252.162 Waterfall 123fox123
22.07.2013 17:20 217.118.78.40  
22.07.2013 17:21 217.118.78.37  
22.07.2013 18:03 109.163.245.128 Kolya 18250287гыык
22.07.2013 18:24 62.183.85.237 Mercenaries rfynbr
22.07.2013 18:30 94.153.18.101 s 
22.07.2013 18:42 193.150.83.194 bestlynx 
22.07.2013 18:57 95.106.187.209 retro2013qwasqwas 
22.07.2013 19:04 212.80.36.74 whitewings 5676727
22.07.2013 19:16 188.123.237.168 Чужой Bkmz11
22.07.2013 19:21 62.221.56.35  
22.07.2013 19:23 188.123.237.168 Чужой Bkmz11
22.07.2013 19:24 188.123.237.168 Чужой Bkmz11
22.07.2013 19:24 188.123.237.168 Чужой Bkmz11
22.07.2013 19:35 176.101.4.236 arek arek522087
2013-07-22 20:36 212.3.100.187 4479956 => FANAT User stuck in battle 151030.
22.07.2013 20:43 37.194.196.95 bleid papugai123
2013-07-22 21:10 176.101.4.236 4477741 => AREK User stuck in battle 151167.
22.07.2013 21:22 77.52.183.138 император 
2013-07-22 21:30 5.134.62.193 4478019 => ZEPKO User stuck in battle 150926.
22.07.2013 21:36 188.64.12.87 miman mirivade53626
2013-07-22 22:10 95.86.166.221 4479522 => Ахиллес User stuck in battle 151253.
22.07.2013 22:30 217.168.185.61 bk xacmaz asd555
22.07.2013 23:01 188.64.12.87 miman mirivade53626
22.07.2013 23:25 46.200.90.114  
22.07.2013 23:39 86.100.76.131 Валькирия ni91ka92
23.07.2013 00:21 195.182.194.105  
23.07.2013 00:44 77.52.183.138 император milana
23.07.2013 01:20 176.8.22.39 ладочка вася12
23.07.2013 01:20 176.8.22.39 ладочка dfcz12
23.07.2013 01:21 176.8.22.39 ладочка samsung12
23.07.2013 01:21 176.8.22.39 ладочка grizli12
23.07.2013 01:21 176.8.22.39 ладочка dfcz12
23.07.2013 01:21 176.8.22.39 ладочка 0966273908
23.07.2013 01:21 176.8.22.39 ладочка karlo12
2013-07-23 03:00 37.229.105.248 4478086 => крутмен User stuck in battle 152824.
2013-07-23 03:20 89.248.81.171 4478070 => CMRZ User stuck in battle 152944.
2013-07-23 03:26 89.248.81.171 4478070 => CMRZ User stuck in battle 152994.
2013-07-23 03:37 95.86.166.221 4479522 => Ахиллес User stuck in battle 153039.
2013-07-23 03:48 89.248.81.171 4478070 => CMRZ User stuck in battle 153088.
23.07.2013 05:29 46.247.165.17 удар das000
23.07.2013 09:37 77.50.223.13 alloha hero63
23.07.2013 10:05 178.72.181.232 Harutik Arutik2558
23.07.2013 10:50 89.191.109.117 Кокетка nikola777
23.07.2013 11:33 86.100.76.131 Валькирия ni91ka92
2013-07-23 12:19 91.235.39.46 4478018 => Черноглазая User stuck in battle 154375.
23.07.2013 12:19 91.200.64.198 Plan4eg vitalik2013
23.07.2013 12:21 188.227.212.213 zepko emrah199
2013-07-23 12:26 178.150.209.83 4476298 => Грюндик User stuck in battle 154401.
2013-07-23 12:37 178.150.209.83 4476298 => Грюндик User stuck in battle 154455.
23.07.2013 12:38 188.138.189.207 ou shert 19837
23.07.2013 12:39 188.138.189.207 ou shert 199389
23.07.2013 12:39 188.138.189.207 ou shert nhbnjy
23.07.2013 12:39 188.138.189.207 morwen 198327
23.07.2013 12:39 188.138.189.207 morwen 199389
23.07.2013 12:39 188.138.189.207 morwen nhbnjy
23.07.2013 12:39 188.138.189.207 am xe 198327
23.07.2013 12:39 188.138.189.207 am xe 199389
23.07.2013 12:39 188.138.189.207 oushert 198327
23.07.2013 12:39 188.138.189.207 oushert 199389
23.07.2013 12:40 188.138.189.207 ou shert kaban199
23.07.2013 12:41 188.138.189.207 ou shert 199389198327
23.07.2013 12:43 188.138.189.207 ou shert nhbnjy
23.07.2013 12:45 195.72.158.243 мудрец funtik1986
2013-07-23 13:26 62.183.85.225 4479987 => Mercenaries User stuck in battle 154743.
2013-07-23 13:47 91.235.39.46 4478088 => Крутой Батя User stuck in battle 154851.
23.07.2013 14:33 80.245.118.58  
23.07.2013 14:46 92.52.128.21 DimiCh dimich91
2013-07-23 14:57 178.35.224.229 4479306 => Лия дебомон User stuck in battle 155128.
23.07.2013 15:12 80.69.61.58 Вор всегда Зор idis055
23.07.2013 15:27 178.35.232.247 mERCENARIES КАНТИК
23.07.2013 15:30 159.148.124.76 papaye manyman
23.07.2013 15:30 159.148.124.76 papaye drakon11
23.07.2013 15:30 159.148.124.76 zpl manyman
23.07.2013 15:30 159.148.124.76 zapal manyman
23.07.2013 16:32 46.175.75.113 bugaina мируфак55
23.07.2013 16:33 62.217.155.213  
23.07.2013 16:33 62.217.155.213  
23.07.2013 16:42 213.111.145.170 czero com3com3
23.07.2013 16:53 46.227.191.180 Весельчак У tahtar1330719
23.07.2013 16:53 46.227.191.180 Весельчак У tahtar2592182
23.07.2013 16:54 46.227.191.180 Весельчак У tahtar569394
23.07.2013 17:24 62.221.56.35  
23.07.2013 17:24 62.221.56.35  
2013-07-23 17:31 91.231.255.176 4479868 => Дед мороз User stuck in battle 156146.
23.07.2013 17:39 46.227.191.180 Весельчак У tahtar1330719
23.07.2013 17:40 46.227.191.180 Весельчак У tah1339719tar
23.07.2013 17:40 46.227.191.180 Весельчак У tahtar
23.07.2013 17:40 46.227.191.180 Весельчак У tahtar2592182
23.07.2013 17:41 46.227.191.180 Весельчак У anton1330719
23.07.2013 17:47 95.65.77.91 CLON denis841
23.07.2013 17:57 188.32.216.165 шмоль safulina10
2013-07-23 18:11 217.19.208.106 4479653 => BPAN User stuck in battle 156463.
23.07.2013 18:21 46.247.180.109 злюка 
23.07.2013 18:33 83.149.35.121 STENABIT sadam12
23.07.2013 18:48 81.21.87.189 stariy ceka
23.07.2013 18:49 193.150.80.8 bestlynx 
23.07.2013 19:06 91.242.21.128 white old wolf natiq55
23.07.2013 19:21 86.100.76.131 Валькирия тш19лф92
23.07.2013 19:28 86.100.76.131 Валькирия тш19лф92
23.07.2013 19:32 213.111.156.104 czero com3com3
2013-07-23 19:36 109.205.211.221 4479925 => MIman User stuck in battle 157089.
2013-07-23 19:58 178.35.225.30 4479987 => Mercenaries User stuck in battle 157301.
2013-07-23 20:16 195.246.102.58 4479758 => Далиша User stuck in battle 157376.
23.07.2013 20:28 193.142.219.62 Club Dance boe12
23.07.2013 20:56 188.32.216.165  
23.07.2013 21:08 46.247.180.109  
23.07.2013 21:27 46.247.185.230  
23.07.2013 21:43 46.247.185.230  
23.07.2013 21:53 46.203.179.70 Вершитель Судеб 1й1й1й
23.07.2013 21:57 46.247.185.230  
23.07.2013 22:10 46.247.178.249  
2013-07-23 22:14 94.19.41.150 4479988 => Ультрас User stuck in battle 157904.
23.07.2013 22:31 62.221.56.35 last don 29oleg6
23.07.2013 22:33 46.247.178.249  
23.07.2013 22:44 46.247.178.249  
23.07.2013 22:53 176.113.35.174 Логин 
23.07.2013 23:39 46.247.178.249  
23.07.2013 23:50 93.116.33.211 Шпилли Уилли 159453-
2013-07-24 01:06 46.23.109.83 4479685 => BLACK_ANGEL User stuck in battle 158963.
2013-07-24 01:12 176.8.22.39 4476932 => KARLO User stuck in battle 159010.
2013-07-24 01:14 176.8.22.39 4476932 => KARLO User stuck in battle 159005.
2013-07-24 01:23 176.8.22.39 4476932 => KARLO User stuck in battle 159054.
24.07.2013 01:28 91.200.200.2 Fearde 200886310753
24.07.2013 01:28 91.200.200.2 Fearde 200886310753
24.07.2013 09:24 77.121.214.170 ВНИМАНИЕ Я берёёзка24
24.07.2013 09:47 91.231.252.112 адмерал Dell2013
24.07.2013 11:52 217.118.78.46 Волшебство мама7710
2013-07-24 11:55 86.100.76.131 4479060 => Валькирия User stuck in battle 160936.
2013-07-24 12:09 86.100.76.131 4479060 => Валькирия User stuck in battle 161070.
24.07.2013 12:37 159.160.244.235  
24.07.2013 12:45 217.150.39.233 опорохап 13101985
24.07.2013 13:16 89.147.247.16 Musluman 055706306
24.07.2013 13:20 88.151.194.95 рома из баку ramil1q2w3e
24.07.2013 13:20 88.151.194.95 рома из баку ramil1q2w3e4r
24.07.2013 15:03 94.179.122.18 Freedom 
2013-07-24 16:09 195.246.102.57 4479530 => Винни ПуХ User stuck in battle 162795.
24.07.2013 16:22 178.90.238.3 Кронос 020287фыф
2013-07-24 16:39 37.61.9.169 4479674 => MexaniK User stuck in battle 163124.
24.07.2013 16:47 159.148.124.76 Геморой drakon11
2013-07-24 17:17 91.200.64.198 4479926 => Plan4eg User stuck in battle 163482.
2013-07-24 17:24 62.183.85.247 4479987 => Mercenaries User stuck in battle 163585.
24.07.2013 17:25 78.25.122.161 s 
24.07.2013 17:46 213.154.31.99 myname йцйцчя
2013-07-24 18:06 178.72.183.190 4476958 => УкУрИнАя ЧеБуРаШкА User stuck in battle 163824.
24.07.2013 18:44 188.123.230.157 Gud in tak ЙЯЦЧУСКМ12
24.07.2013 18:44 188.123.230.157 Gud in tak ЙЯЦЧУСКМ12
24.07.2013 18:59 193.238.96.46 Jojo lunda1OvEn
24.07.2013 19:18 46.247.164.229 удар GFHJKM
24.07.2013 19:18 46.247.164.229 удар GFHJKM
24.07.2013 19:18 46.247.164.229 удар GFHJKM
24.07.2013 19:19 46.247.164.229 удар ПАРОЛЬ
24.07.2013 19:19 46.247.164.229 удар GFHJKM
24.07.2013 19:20 88.156.163.235  
24.07.2013 19:25 178.35.231.183 Mecenaries кантик
24.07.2013 19:25 178.35.231.183 Mecenaries кантик
2013-07-24 19:50 91.124.239.97 4479617 => злюка User stuck in battle 164744.
2013-07-24 20:10 188.64.14.183 4479524 => Tarman Faraon User stuck in battle 165011.
2013-07-24 20:23 195.246.102.48 4479530 => Винни ПуХ User stuck in battle 165155.
2013-07-24 20:29 91.235.37.134 4478088 => Крутой Батя User stuck in battle 165077.
24.07.2013 20:33 188.123.230.157 Gud in tak ЙЯЦЧУСКМ12
24.07.2013 20:35 212.3.100.187 Emhyr var Emreis 10z20x
24.07.2013 20:43 78.25.122.161 smert koos1
24.07.2013 20:49 93.79.74.130 valyrik 32221189
24.07.2013 20:58 95.158.48.43 агент малдер 53015581988
24.07.2013 21:04 195.182.194.215 Серафим Thevef10
24.07.2013 21:08 188.32.216.165 шмоль safulina10
24.07.2013 21:08 188.32.216.165 шмоль Safylina10
24.07.2013 21:08 188.32.216.165 шмоль safylina10
24.07.2013 21:09 188.32.216.165 шмоль safylina10
24.07.2013 21:09 188.32.216.165 шмоль Safulina10
24.07.2013 21:09 188.32.216.165 шмоль safulina10
24.07.2013 21:09 188.32.216.165 шмоль Safylina10
24.07.2013 21:09 188.32.216.165 шмоль ыфагдштф10
24.07.2013 21:10 188.32.216.165 inspector Safulina10
2013-07-24 21:22 91.242.19.70 4479803 => white old wolf User stuck in battle 165753.
24.07.2013 21:28 37.54.20.250  
24.07.2013 21:56 195.216.210.234 Логин 
2013-07-24 22:12 77.52.183.138 4476802 => Император User stuck in battle 166117.
2013-07-24 23:21 195.58.236.66 4477755 => reptil User stuck in battle 166589.
2013-07-24 23:53 193.16.101.239 4478347 => Ревизор User stuck in battle 166895.
2013-07-24 23:57 195.246.102.59 4479758 => Далиша User stuck in battle 166880.
2013-07-25 00:10 46.175.73.28 24506 => bugaina User stuck in battle 166864.
25.07.2013 00:26 188.237.176.79 CptnDeen kaka10
25.07.2013 00:26 188.237.176.79 CptnDeen _opti_mist
25.07.2013 00:28 188.237.176.79 CptnDeen kaka10
25.07.2013 00:28 188.237.176.79 optimist kaka10
25.07.2013 00:28 188.237.176.79 optimist _opti_mist
2013-07-25 00:59 46.23.108.250 4479685 => BLACK_ANGEL User stuck in battle 167365.
2013-07-25 01:01 46.23.108.250 4479685 => BLACK_ANGEL User stuck in battle 167370.
25.07.2013 01:50 95.182.89.197 bestlynx ьшыыщгкн25
25.07.2013 03:42 188.138.189.207 ou shert 19832
25.07.2013 07:45 188.138.189.207 ou shert 1983217
25.07.2013 08:42 164.0.177.242 Ales 506739
25.07.2013 09:27 69.84.207.246  
25.07.2013 10:07 193.238.96.46 Jojo lunda1OvEn
25.07.2013 10:43 193.238.96.46 Jojo yfabudf
25.07.2013 10:56 89.147.247.16 Musluman 05570638006
25.07.2013 11:13 193.107.246.22 BILBASUMKIN 280387
25.07.2013 11:15 193.107.246.22 BILBASUMKIN 280387
25.07.2013 12:07 95.158.48.43 агент малдер 53015581988
25.07.2013 12:13 2.94.91.203 Неоспоримый щлы2081988
25.07.2013 13:08 193.238.96.46 Прометей floppy disk
25.07.2013 13:23 188.32.216.165 Логин 
25.07.2013 13:50 93.74.78.103 ночной житель 5541ё803
2013-07-25 14:31 5.134.62.86 4478019 => ZEPKO User stuck in battle 170771.
25.07.2013 14:38 95.135.126.151 дубалом роман3081990
25.07.2013 14:38 95.135.126.151 дубалом 30819
25.07.2013 14:38 95.135.126.151 дубалом 30819
25.07.2013 14:46 91.200.218.205 винни пух ben110
25.07.2013 15:08 193.238.96.46 Jojo lunda1OvEn
2013-07-25 15:19 193.238.96.46 4478969 => Jojo User stuck in battle 171334.
25.07.2013 15:32 178.72.183.190 MephistopheleS aaz102
25.07.2013 15:32 178.72.183.190 MephistopheleS aaz102
25.07.2013 15:32 178.72.183.190 MephistopheleS aaz102
25.07.2013 16:17 212.47.148.221  
25.07.2013 16:28 217.168.186.35 bk xacmaz asd555
25.07.2013 16:28 217.168.186.35 bk xacmaz asd123
25.07.2013 16:29 217.168.186.35 bk xacmaz isi111
25.07.2013 16:29 217.168.186.35 bk xacmaz asd111
25.07.2013 16:29 217.168.186.35 bk xacmaz qwer123
25.07.2013 16:29 217.168.186.35 bk xacmaz asd555
25.07.2013 16:35 89.147.223.49 somkax elwen96
25.07.2013 16:51 91.218.160.7 Мирзоев 1025030фф
25.07.2013 16:51 91.218.160.7 Мирзоев 1025030фф
25.07.2013 16:51 91.218.160.7 Мирзоев 1025030фф
25.07.2013 16:51 91.218.160.7 Мирзоев 1025030фф
25.07.2013 16:57 193.238.96.46 Прометей lunda1OVEn
2013-07-25 20:04 176.8.88.135 4479710 => yurec1989 User stuck in battle 173804.
2013-07-25 20:35 195.182.194.122 4478374 => Серафим User stuck in battle 174098.
25.07.2013 20:51 109.237.112.202 savetski quli9402761
25.07.2013 21:00 85.132.86.169 вор всегда зор idos055
25.07.2013 21:07 37.61.104.91 mexanik vaz2197
2013-07-25 21:10 109.237.112.202 4479470 => bez pridel User stuck in battle 174350.
2013-07-25 21:22 91.231.255.176 4479868 => Дед мороз User stuck in battle 174464.
25.07.2013 21:26 95.27.35.147 Рыжий 41623714
25.07.2013 21:26 95.27.35.147 Рыжий 41623714cf
25.07.2013 21:26 95.27.35.147 Quartz 41623714cf
25.07.2013 21:27 212.3.100.187 fanat 
25.07.2013 21:35 93.79.74.130 valyrik 322`1
2013-07-25 21:54 212.3.100.187 4479956 => FANAT User stuck in battle 174710.
25.07.2013 22:14 86.100.76.131 Валькирия тш19лф92
2013-07-25 22:30 178.72.183.190 4476958 => УкУрИнАя ЧеБуРаШкА User stuck in battle 174903.
2013-07-25 22:44 195.182.194.122 4478374 => Серафим User stuck in battle 174989.
2013-07-25 22:44 164.215.101.239 4479925 => MIman User stuck in battle 174989.
2013-07-25 22:54 37.61.104.91 4479674 => MexaniK User stuck in battle 175066.
25.07.2013 23:12 95.153.111.207 Brain fasr12
25.07.2013 23:12 95.153.111.207 Brain gast12
25.07.2013 23:14 188.123.230.157 Gud in tak ЙЯЦЧУСКМ12
25.07.2013 23:14 188.123.230.157 Gud in tak ЙЯЦЧУСКМ12
2013-07-25 23:18 95.153.111.207 4479247 => Brain User stuck in battle 175116.
2013-07-25 23:18 193.161.14.173 24248 => Добрый User stuck in battle 175116.
2013-07-25 23:20 37.61.104.91 4479674 => MexaniK User stuck in battle 175189.
2013-07-25 23:28 94.178.146.152 4479617 => злюка User stuck in battle 175236.
2013-07-25 23:28 212.3.100.187 4479956 => FANAT User stuck in battle 175236.
25.07.2013 23:31 164.215.101.239 tarman faraon kenanuray
25.07.2013 23:31 164.215.101.239 tarman faraon kenanuray
25.07.2013 23:31 164.215.101.239 tarman faraon kenanuray
25.07.2013 23:33 212.3.100.187 Emhyr var Emreis 
25.07.2013 23:59 91.124.44.180 стилет Катруся
25.07.2013 23:59 91.124.44.180 стилет Катруся
26.07.2013 00:46 217.118.95.83 volter evgen88
26.07.2013 01:13 91.231.233.253 deadmau5 spartak23
26.07.2013 01:14 91.231.233.253 deadmau5 spartak23
26.07.2013 01:14 91.231.233.253 deadmau55 spartak23
26.07.2013 01:15 91.231.233.253 deadmau5 spartak23
26.07.2013 02:10 37.114.144.78 оптимус elgun7492528
26.07.2013 08:31 178.94.86.20 инкогниито ytghtlcrfpetvjcnm
26.07.2013 08:31 178.94.86.20 инкогниито непредсказуемость
26.07.2013 08:31 178.94.86.20 инкогниито ztghtlcrfpetvjcnm
26.07.2013 08:31 178.94.86.20 инкогниито непредсказуемость
26.07.2013 09:36 80.245.118.58  
26.07.2013 09:36 80.245.118.58 mephistopheles 
26.07.2013 10:30 91.218.171.148 S-mer-t hero63
26.07.2013 10:49 176.28.83.7 Simon aze555
2013-07-26 11:04 91.218.168.141 4478088 => Крутой Батя User stuck in battle 177441.
2013-07-26 11:34 109.227.96.141 4476137 => ксенька User stuck in battle 177669.
26.07.2013 12:12 37.61.100.228 Bewenniy Bik elnur42567784
26.07.2013 12:12 37.61.100.228 Bewenniy Bik elnur42567784
26.07.2013 12:12 37.61.100.228 Bewenniy Bik elnur8718120
26.07.2013 12:13 37.61.100.228 Bewenniy Bik 123456
26.07.2013 12:37 212.3.100.187 Emhyr var Emreis 10я20ч30с
26.07.2013 12:43 213.147.45.244 Чужой Bkmz11
26.07.2013 12:43 213.147.45.244 Чужой Bkmz11
26.07.2013 13:23 37.61.127.96 asdasd asdasd
26.07.2013 13:29 31.13.60.46 serejams alina5705095
26.07.2013 13:29 31.13.60.46 serejams alina5705095
26.07.2013 13:35 89.147.227.242 ghostx elwen96
26.07.2013 13:35 89.147.227.242 ghostx noparols
26.07.2013 13:51 85.9.137.124 BOSS Masxa88
26.07.2013 15:13 109.188.126.245 Assissa 123asd
26.07.2013 15:17 212.3.100.187 fabat 101299
2013-07-26 15:24 109.161.96.168 4480014 => retro2013 User stuck in battle 179679.
2013-07-26 15:25 77.50.223.13 4479701 => liberal User stuck in battle 179680.
2013-07-26 15:25 188.134.35.10 7 => No Name User stuck in battle 179681.
2013-07-26 15:25 109.161.96.168 4480014 => retro2013 User stuck in battle 179682.
2013-07-26 15:31 77.122.157.95 4478225 => Непобедимый User stuck in battle 179633.
2013-07-26 15:35 77.122.157.95 4478225 => Непобедимый User stuck in battle 179731.
2013-07-26 15:45 212.3.100.187 4479956 => FANAT User stuck in battle 179749.
26.07.2013 15:54 31.13.60.46 serejams alina5705095
2013-07-26 16:04 46.22.229.151 4479442 => stariy User stuck in battle 179776.
2013-07-26 16:10 212.3.100.187 4476595 => Emhyr var Emreis User stuck in battle 179933.
26.07.2013 16:22 91.200.64.198 vladzka vladzka28
2013-07-26 16:59 164.215.100.171 4479925 => MIman User stuck in battle 180111.
2013-07-26 17:03 178.76.3.77 4479674 => MexaniK User stuck in battle 180246.
2013-07-26 17:04 46.22.229.151 4479442 => stariy User stuck in battle 180251.
2013-07-26 17:05 46.22.229.151 4479442 => stariy User stuck in battle 180260.
2013-07-26 17:05 178.76.3.77 4479674 => MexaniK User stuck in battle 180260.
2013-07-26 17:11 46.22.229.151 4479442 => stariy User stuck in battle 180270.
2013-07-26 17:18 89.248.81.171 4478070 => CMRZ User stuck in battle 180331.
26.07.2013 17:32 46.211.122.212 maestro 1q1q1q
2013-07-26 17:45 46.22.229.151 4479470 => bez pridel User stuck in battle 180507.
26.07.2013 17:54 46.22.229.151 stariy ceka22
26.07.2013 17:54 46.22.229.151 stariy asdfqwer
26.07.2013 17:54 46.22.229.151 stariy ceka22
26.07.2013 18:03 80.245.118.58  
26.07.2013 18:38 95.158.48.43 агент малдер 53015581988
26.07.2013 18:41 37.215.10.210 Nik-atin mkdk90981845
2013-07-26 18:49 5.134.63.122 4478019 => ZEPKO User stuck in battle 180962.
26.07.2013 18:51 193.150.80.8 bestlynx 
26.07.2013 19:28 95.65.77.91 CLON denis/1
26.07.2013 19:34 46.211.122.212 Скромняга 1й1й1й
2013-07-26 19:39 77.122.157.95 4478225 => Непобедимый User stuck in battle 181414.
26.07.2013 19:53 212.3.100.187 fanat 
26.07.2013 20:21 164.215.100.171 miman mirihttp://hdfilmizlemeliyiz.blogspot.com/2013/04/kung-fu-panda-1-turkce-dublaj-hd-izle_11.htmlade53626
26.07.2013 20:41 5.44.39.176 favorit 
26.07.2013 20:43 176.8.238.102 Апарат 
2013-07-26 20:48 91.231.255.176 4479868 => Дед мороз User stuck in battle 182029.
2013-07-26 21:58 62.221.76.12 4479247 => Brain User stuck in battle 182607.
2013-07-26 21:59 91.218.168.141 4478018 => Черноглазая User stuck in battle 182611.
2013-07-26 22:00 91.218.168.141 4478018 => Черноглазая User stuck in battle 182624.
26.07.2013 22:03 212.93.100.57 zusans14 nauris15
26.07.2013 22:03 212.93.100.57 nauris14 zusans14
26.07.2013 22:27 212.3.100.187 Emhyr var Emreis 
26.07.2013 22:28 37.61.80.12 каталец 123321
2013-07-26 22:36 77.122.157.95 4478225 => Непобедимый User stuck in battle 182836.
26.07.2013 22:40 37.79.83.233 Святой тамплиер уйацпй4у
26.07.2013 22:40 37.79.83.233 Святой тамплиер уйацпй4у
26.07.2013 23:05 212.142.69.87 180razevg1 
26.07.2013 23:05 212.142.69.87 180razevg1 1980raevg1
26.07.2013 23:17 217.118.78.82 Врошебство vfvf7710
26.07.2013 23:18 217.118.78.82 Врошебство vfvf7710
26.07.2013 23:25 94.20.241.84 komandos йгвкуе0556420100
2013-07-26 23:25 46.23.109.194 4479685 => BLACK_ANGEL User stuck in battle 183564.
26.07.2013 23:37 178.158.236.226 DAVID 1QWE1QWE1QWE
26.07.2013 23:48 37.61.127.96 azerbaijan 1991mqy066
26.07.2013 23:49 62.217.155.213 reddevil lamsamir
2013-07-26 23:51 93.116.33.211 4477659 => Шпилли Уилли User stuck in battle 183732.
27.07.2013 00:02 46.211.180.239 maestro 1q1q1q
27.07.2013 00:02 46.211.180.239 maestro 1q1q1q
2013-07-27 00:14 86.100.76.131 4479060 => Валькирия User stuck in battle 184063.
27.07.2013 00:19 217.168.186.45 aladdin asd555
27.07.2013 00:25 193.150.80.8 bestlynx 
2013-07-27 00:50 46.23.109.194 4479685 => BLACK_ANGEL User stuck in battle 184491.
27.07.2013 01:00 193.150.80.8 bestlynx 
27.07.2013 01:00 193.150.80.8 Логин missoury25
27.07.2013 01:03 91.190.115.250 smert 
2013-07-27 01:07 46.23.109.194 4479685 => BLACK_ANGEL User stuck in battle 184660.
27.07.2013 02:14 93.170.12.232 jjif wasp3773759
27.07.2013 03:20 217.118.95.91 trakdss evgen88
27.07.2013 03:37 37.61.80.12 каталоец 123321
27.07.2013 07:05 85.9.137.123 BOSS Vasxad88
27.07.2013 07:41 91.190.115.250 smert 
27.07.2013 07:59 37.57.220.119 BILA-SUMKIN 280387
27.07.2013 09:11 212.3.100.187 Emhyr var Emreis 10z20x3
27.07.2013 09:24 85.9.137.121 BOSS &lt;asxad88
27.07.2013 09:24 85.9.137.121 BOSS Masxad888
27.07.2013 09:44 62.217.155.213 Я ахилес nazim05555579082
27.07.2013 09:52 5.248.40.246 Демми Мурррк йфяяфй1987
27.07.2013 10:15 164.215.98.14 mimAN 
27.07.2013 10:29 46.211.121.241 maestro 1q1q1q
27.07.2013 10:29 46.211.121.241 maestro 1q1q1q
2013-07-27 11:09 164.215.98.14 4479925 => MIman User stuck in battle 187155.
2013-07-27 11:15 188.123.230.157 4476061 => Gud in tak User stuck in battle 187182.
27.07.2013 11:37 80.90.24.214 zusans14 nauris14
27.07.2013 11:44 93.181.208.58 retro2013 wqasqwas
2013-07-27 12:23 93.181.208.58 4480014 => retro2013 User stuck in battle 187936.
2013-07-27 12:40 193.161.14.171 24248 => Добрый User stuck in battle 188064.
2013-07-27 13:23 5.134.63.89 4478019 => ZEPKO User stuck in battle 188281.
2013-07-27 13:27 46.247.186.231 4477372 => удар User stuck in battle 188479.
2013-07-27 13:31 77.122.157.95 4478225 => Непобедимый User stuck in battle 188518.
2013-07-27 13:38 5.134.63.89 4478019 => ZEPKO User stuck in battle 188483.
27.07.2013 13:52 94.180.133.149 Тики Микк e[ybrflf1x
2013-07-27 14:00 77.122.157.95 4478225 => Непобедимый User stuck in battle 188640.
2013-07-27 14:09 37.229.105.248 4478086 => крутмен User stuck in battle 188779.
2013-07-27 14:10 37.61.124.242 4479674 => MexaniK User stuck in battle 188588.
27.07.2013 14:12 195.246.102.58 далиша ybubyf
27.07.2013 14:12 195.246.102.58 Логин нигина
27.07.2013 14:36 80.66.158.28 John Doe 123фыв
2013-07-27 15:04 195.246.102.58 4479758 => Далиша User stuck in battle 189125.
